Fasta headers,Reporter intensity corrected 0,Reporter intensity corrected 1,Reporter intensity corrected 2,Reporter intensity corrected 3,Reporter intensity corrected 4,Reporter intensity corrected 5
"tr|Q542R8|Q542R8_MOUSE Guanine nucleotide binding protein, alpha z subunit, isoform CRA_a OS=Mus musculus OX=10090 GN=Gnaz PE=1 SV=1;sp|O70443|GNAZ_MOUSE Guanine nucleotide-binding protein G(z) subunit alpha OS=Mus musculus OX=10090 GN=Gnaz PE=1 SV=4;tr|Q3",26764000,26066000,26202000,16975000,13232000,28181000
tr|Q9JJ20|Q9JJ20_MOUSE 14-3-3 protein sigma OS=Mus musculus OX=10090 GN=Sfn PE=2 SV=1;sp|O70456|1433S_MOUSE 14-3-3 protein sigma OS=Mus musculus OX=10090 GN=Sfn PE=1 SV=2,19229000,20056000,7282500,25237000,25024000,6897500
tr|Q8BSN6|Q8BSN6_MOUSE Vesicle-associated membrane protein 4 OS=Mus musculus OX=10090 GN=Vamp4 PE=1 SV=1;sp|O70480|VAMP4_MOUSE Vesicle-associated membrane protein 4 OS=Mus musculus OX=10090 GN=Vamp4 PE=1 SV=1,21482,17255,10308,17707,18148,18165
"tr|Q6ZWQ5|Q6ZWQ5_MOUSE Sorting nexin 12, isoform CRA_c OS=Mus musculus OX=10090 GN=Snx12 PE=1 SV=1;tr|Q99M52|Q99M52_MOUSE Sorting nexin 12 OS=Mus musculus OX=10090 GN=Snx12 PE=2 SV=1;tr|Q3TGS7|Q3TGS7_MOUSE Sorting nexin 12, isoform CRA_b OS=Mus musculus OX",3408500,3641800,3615500,2859300,2015700,3651400
tr|O70569|O70569_MOUSE Ribosomal protein S14 OS=Mus musculus OX=10090 GN=rps14 PE=3 SV=1;sp|P62264|RS14_MOUSE 40S ribosomal protein S14 OS=Mus musculus OX=10090 GN=Rps14 PE=1 SV=3;tr|D3YVF4|D3YVF4_MOUSE 40S ribosomal protein S14 (Fragment) OS=Mus musculus ,2973700,3659000,2788000,2520100,1801700,3183500
tr|Q3TE06|Q3TE06_MOUSE Uncharacterized protein (Fragment) OS=Mus musculus OX=10090 GN=Wdr1 PE=2 SV=1;tr|Q9DC08|Q9DC08_MOUSE Uncharacterized protein OS=Mus musculus OX=10090 GN=Wdr1 PE=2 SV=1;tr|Q9DBM8|Q9DBM8_MOUSE Uncharacterized protein OS=Mus musculus OX,30983000,32614000,29889000,27554000,20909000,30723000
tr|Q8C454|Q8C454_MOUSE Uncharacterized protein OS=Mus musculus OX=10090 GN=Mtx2 PE=2 SV=1;tr|Q3TI40|Q3TI40_MOUSE Uncharacterized protein OS=Mus musculus OX=10090 GN=Mtx2 PE=2 SV=1;tr|Q3TI19|Q3TI19_MOUSE Uncharacterized protein OS=Mus musculus OX=10090 GN=M,540770,669280,650310,440690,318840,609000
tr|Q3TEL0|Q3TEL0_MOUSE Uncharacterized protein OS=Mus musculus OX=10090 GN=Ppt1 PE=2 SV=1;tr|Q3UB92|Q3UB92_MOUSE Uncharacterized protein OS=Mus musculus OX=10090 GN=Ppt1 PE=2 SV=1;tr|Q3U6W3|Q3U6W3_MOUSE Uncharacterized protein OS=Mus musculus OX=10090 GN=P,2223600,1763500,2609700,1501800,1200000,2337500
tr|Q5SUV8|Q5SUV8_MOUSE Uncharacterized protein OS=Mus musculus OX=10090 GN=Ddc PE=1 SV=1;sp|O88533|DDC_MOUSE Aromatic-L-amino-acid decarboxylase OS=Mus musculus OX=10090 GN=Ddc PE=1 SV=1,298820,151140,323920,145450,227080,243140
tr|Q8BX58|Q8BX58_MOUSE Uncharacterized protein OS=Mus musculus OX=10090 PE=2 SV=1;tr|Q3UQL2|Q3UQL2_MOUSE Uncharacterized protein OS=Mus musculus OX=10090 GN=Cops3 PE=1 SV=1;sp|O88543|CSN3_MOUSE COP9 signalosome complex subunit 3 OS=Mus musculus OX=10090 GN,69553,41423,58683,35025,27227,57298
"tr|Q3TIJ1|Q3TIJ1_MOUSE Uncharacterized protein OS=Mus musculus OX=10090 GN=Cops4 PE=2 SV=1;tr|Q14AI7|Q14AI7_MOUSE COP9 (Constitutive photomorphogenic) homolog, subunit 4 (Arabidopsis thaliana) OS=Mus musculus OX=10090 GN=Cops4 PE=1 SV=1;sp|O88544|CSN4_MOUS",3438000,3790800,3250500,2388400,2186700,3088800
tr|Q3TS50|Q3TS50_MOUSE Uncharacterized protein (Fragment) OS=Mus musculus OX=10090 GN=Hnrnpu PE=2 SV=1;tr|Q3TGN5|Q3TGN5_MOUSE Uncharacterized protein OS=Mus musculus OX=10090 GN=Hnrnpu PE=2 SV=1;tr|O88568|O88568_MOUSE Heterogenous nuclear ribonucleoprotein,9987700,10275000,6877900,6817000,4726500,9168200
sp|O88587|COMT_MOUSE Catechol O-methyltransferase OS=Mus musculus OX=10090 GN=Comt PE=1 SV=2,761270,712490,795980,654810,453170,750460
"tr|Q3ZB20|Q3ZB20_MOUSE Calcium channel, voltage-dependent, gamma subunit 2 OS=Mus musculus OX=10090 GN=Cacng2 PE=1 SV=1;sp|O88602|CCG2_MOUSE Voltage-dependent calcium channel gamma-2 subunit OS=Mus musculus OX=10090 GN=Cacng2 PE=1 SV=1",320040,237460,359130,300190,176690,546110
sp|O88737|BSN_MOUSE Protein bassoon OS=Mus musculus OX=10090 GN=Bsn PE=1 SV=4,36690000,41986000,29691000,29628000,18161000,38209000
tr|Q3UEX4|Q3UEX4_MOUSE Uncharacterized protein OS=Mus musculus OX=10090 GN=Gdap1 PE=2 SV=1;sp|O88741|GDAP1_MOUSE Ganglioside-induced differentiation-associated protein 1 OS=Mus musculus OX=10090 GN=Gdap1 PE=1 SV=1;tr|Q3UTV3|Q3UTV3_MOUSE Uncharacterized pro,2839000,2599800,2958200,1680700,1541300,2617500
tr|Q561M4|Q561M4_MOUSE Target of myb1 homolog (Chicken) OS=Mus musculus OX=10090 GN=Tom1 PE=2 SV=1;tr|Q3UDC3|Q3UDC3_MOUSE Target of Myb protein 1 OS=Mus musculus OX=10090 GN=Tom1 PE=1 SV=1;sp|O88746|TOM1_MOUSE Target of Myb protein 1 OS=Mus musculus OX=100,624580,766770,634260,452140,301080,608250
sp|O88783|FA5_MOUSE Coagulation factor V OS=Mus musculus OX=10090 GN=F5 PE=1 SV=1,85243,62789,28651,100370,39281,115700
"tr|Q9QWR7|Q9QWR7_MOUSE Death adaptor molecule short form OS=Mus musculus OX=10090 GN=Cradd PE=2 SV=1;tr|Q549T4|Q549T4_MOUSE CASP2 and RIPK1 domain containing adaptor with death domain, isoform CRA_a OS=Mus musculus OX=10090 GN=Cradd PE=1 SV=1;sp|O88843|CRA",50672,56962,63001,22358,23398,49070
tr|Q5HZJ8|Q5HZJ8_MOUSE Isocitrate dehydrogenase [NADP] OS=Mus musculus OX=10090 GN=Idh1 PE=2 SV=1;tr|Q3TJ51|Q3TJ51_MOUSE Isocitrate dehydrogenase [NADP] OS=Mus musculus OX=10090 GN=Idh1 PE=2 SV=1;tr|Q8C338|Q8C338_MOUSE Isocitrate dehydrogenase [NADP] OS=Mu,8629700,8960100,8126600,6861400,5201500,8521900
"tr|Q3TR91|Q3TR91_MOUSE Uncharacterized protein OS=Mus musculus OX=10090 GN=Akap10 PE=2 SV=1;sp|O88845|AKA10_MOUSE A-kinase anchor protein 10, mitochondrial OS=Mus musculus OX=10090 GN=Akap10 PE=1 SV=3",92471,116200,102860,80463,54842,113560
tr|Q6XE40|Q6XE40_MOUSE MAGUK p55 subfamily member 3 OS=Mus musculus OX=10090 GN=Mpp3 PE=1 SV=1;sp|O88910|MPP3_MOUSE MAGUK p55 subfamily member 3 OS=Mus musculus OX=10090 GN=Mpp3 PE=1 SV=2,319710,384390,351780,248790,194460,336210
sp|O88935|SYN1_MOUSE Synapsin-1 OS=Mus musculus OX=10090 GN=Syn1 PE=1 SV=2,46598000,54923000,49324000,38768000,32663000,47794000
sp|O88951|LIN7B_MOUSE Protein lin-7 homolog B OS=Mus musculus OX=10090 GN=Lin7b PE=1 SV=2,268140,276390,270830,180970,159250,259470
tr|Q3TTY6|Q3TTY6_MOUSE Uncharacterized protein (Fragment) OS=Mus musculus OX=10090 GN=Lin7c PE=2 SV=1;tr|Q3UX93|Q3UX93_MOUSE Protein lin-7 homolog OS=Mus musculus OX=10090 GN=Lin7c PE=2 SV=1;sp|O88952|LIN7C_MOUSE Protein lin-7 homolog C OS=Mus musculus OX=,7614000,9561100,7614400,6414000,4804400,8627800
sp|O88983|STX8_MOUSE Syntaxin-8 OS=Mus musculus OX=10090 GN=Stx8 PE=1 SV=1,111240,108460,90529,101360,49112,121130
sp|O88990|ACTN3_MOUSE Alpha-actinin-3 OS=Mus musculus OX=10090 GN=Actn3 PE=2 SV=1,548730,483790,611230,474380,353530,644700
tr|Q8R357|Q8R357_MOUSE Noelin OS=Mus musculus OX=10090 GN=Olfm1 PE=1 SV=1;sp|O88998|NOE1_MOUSE Noelin OS=Mus musculus OX=10090 GN=Olfm1 PE=1 SV=1,3677400,4277800,2992900,3277000,2243600,3705700
tr|Q3U9K3|Q3U9K3_MOUSE Coronin OS=Mus musculus OX=10090 GN=Coro1a PE=2 SV=1;tr|Q3U232|Q3U232_MOUSE Coronin OS=Mus musculus OX=10090 GN=Coro1a PE=2 SV=1;tr|Q3U1N0|Q3U1N0_MOUSE Coronin OS=Mus musculus OX=10090 GN=Coro1a PE=1 SV=1;tr|Q3T9L1|Q3T9L1_MOUSE Coron,7922700,8716900,5706100,7235100,5904700,9032100
"tr|Q5RJV3|Q5RJV3_MOUSE Rbm3 protein OS=Mus musculus OX=10090 GN=Rbm3 PE=2 SV=1;tr|Q545K5|Q545K5_MOUSE MCG116386, isoform CRA_a OS=Mus musculus OX=10090 GN=Rbm3 PE=1 SV=1;tr|Q8BG13|Q8BG13_MOUSE RNA-binding protein 3 OS=Mus musculus OX=10090 GN=Rbm3 PE=1 SV=",1006400,1386800,989550,1259500,454120,1673700
sp|O89112|LANC1_MOUSE LanC-like protein 1 OS=Mus musculus OX=10090 GN=Lancl1 PE=1 SV=1;tr|B2KGR2|B2KGR2_MOUSE LanC-like protein 1 (Fragment) OS=Mus musculus OX=10090 GN=Lancl1 PE=1 SV=1,11602000,11555000,11581000,8496300,7189000,12829000
tr|Q99KF5|Q99KF5_MOUSE Hypoxanthine phosphoribosyltransferase OS=Mus musculus OX=10090 GN=Hprt PE=2 SV=1;sp|P00493|HPRT_MOUSE Hypoxanthine-guanine phosphoribosyltransferase OS=Mus musculus OX=10090 GN=Hprt1 PE=1 SV=3,3019400,3727200,2855000,2177400,2302300,2509700
sp|P00920|CAH2_MOUSE Carbonic anhydrase 2 OS=Mus musculus OX=10090 GN=Ca2 PE=1 SV=4;tr|A0A0A6YX78|A0A0A6YX78_MOUSE Carbonic anhydrase 2 (Fragment) OS=Mus musculus OX=10090 GN=Car2 PE=1 SV=1,14629000,16736000,18606000,13503000,10539000,18322000
tr|Q9D239|Q9D239_MOUSE Beta-2-microglobulin OS=Mus musculus OX=10090 GN=B2m PE=2 SV=1;tr|Q3U679|Q3U679_MOUSE Beta-2-microglobulin OS=Mus musculus OX=10090 GN=B2m PE=2 SV=1;sp|P01887|B2MG_MOUSE Beta-2-microglobulin OS=Mus musculus OX=10090 GN=B2m PE=1 SV=2,119980,121810,90167,75137,49633,108700
sp|P03995|GFAP_MOUSE Glial fibrillary acidic protein OS=Mus musculus OX=10090 GN=Gfap PE=1 SV=4,10053000,12541000,11506000,9030900,8183000,11576000
tr|Q9QYT9|Q9QYT9_MOUSE Major prion protein OS=Mus musculus OX=10090 GN=Prnpb PE=3 SV=1;tr|Q4FJQ7|Q4FJQ7_MOUSE Major prion protein OS=Mus musculus OX=10090 GN=Prnp PE=1 SV=1;tr|Q3UG89|Q3UG89_MOUSE Major prion protein OS=Mus musculus OX=10090 GN=Prnp PE=2 SV,389550,339010,330320,307060,118060,336030
sp|P05063|ALDOC_MOUSE Fructose-bisphosphate aldolase C OS=Mus musculus OX=10090 GN=Aldoc PE=1 SV=4,81385000,86958000,87351000,69364000,50323000,94647000
sp|P05132|KAPCA_MOUSE cAMP-dependent protein kinase catalytic subunit alpha OS=Mus musculus OX=10090 GN=Prkaca PE=1 SV=3;tr|J9JDU9|J9JDU9_MOUSE cAMP-dependent protein kinase catalytic subunit alpha isoform (Fragment) OS=Mus musculus OX=10090 GN=Prkaca PE=2,6903300,7016700,6208500,5348500,4802200,5550600
"sp|P05201|AATC_MOUSE Aspartate aminotransferase, cytoplasmic OS=Mus musculus OX=10090 GN=Got1 PE=1 SV=3",78538000,84384000,71277000,67538000,59817000,73179000
"sp|P05202|AATM_MOUSE Aspartate aminotransferase, mitochondrial OS=Mus musculus OX=10090 GN=Got2 PE=1 SV=1",77369000,77741000,60504000,71016000,72703000,54762000
sp|P05213|TBA1B_MOUSE Tubulin alpha-1B chain OS=Mus musculus OX=10090 GN=Tuba1b PE=1 SV=2;tr|Q99KA2|Q99KA2_MOUSE Tubulin alpha chain (Fragment) OS=Mus musculus OX=10090 GN=Tuba1b PE=2 SV=1,500320000,415120000,351890000,478220000,483050000,365260000
sp|P06745|G6PI_MOUSE Glucose-6-phosphate isomerase OS=Mus musculus OX=10090 GN=Gpi PE=1 SV=4;tr|B7ZWL9|B7ZWL9_MOUSE Glucose-6-phosphate isomerase OS=Mus musculus OX=10090 GN=Gpi1 PE=2 SV=1;tr|B2RXT5|B2RXT5_MOUSE Glucose-6-phosphate isomerase OS=Mus musculu,34304000,33548000,26466000,32703000,32810000,22364000
tr|Q99LF5|Q99LF5_MOUSE Me1 protein OS=Mus musculus OX=10090 GN=Me1 PE=2 SV=1;tr|Q921S3|Q921S3_MOUSE Malic enzyme OS=Mus musculus OX=10090 GN=Me1 PE=2 SV=1;sp|P06801|MAOX_MOUSE NADP-dependent malic enzyme OS=Mus musculus OX=10090 GN=Me1 PE=1 SV=2;tr|Q3TQP6|,1503100,1105200,1431800,1044900,806520,1472700
sp|P06837|NEUM_MOUSE Neuromodulin OS=Mus musculus OX=10090 GN=Gap43 PE=1 SV=1,11653000,12136000,3344300,11075000,19302000,2555000
tr|Q9D6A4|Q9D6A4_MOUSE Transthyretin OS=Mus musculus OX=10090 GN=Ttr PE=2 SV=1;tr|Q5M9K1|Q5M9K1_MOUSE Transthyretin OS=Mus musculus OX=10090 GN=Ttr PE=1 SV=1;sp|P07309|TTHY_MOUSE Transthyretin OS=Mus musculus OX=10090 GN=Ttr PE=1 SV=1,110850,60878,275140,195730,129750,202430
tr|Q546G4|Q546G4_MOUSE Albumin 1 OS=Mus musculus OX=10090 GN=Alb PE=1 SV=1;sp|P07724|ALBU_MOUSE Serum albumin OS=Mus musculus OX=10090 GN=Alb PE=1 SV=3,65543000,59570000,87194000,81134000,45228000,51983000
"tr|Q80Y52|Q80Y52_MOUSE Heat shock protein 90, alpha (Cytosolic), class A member 1 OS=Mus musculus OX=10090 GN=Hsp90aa1 PE=1 SV=2;tr|Q3UIF3|Q3UIF3_MOUSE Uncharacterized protein OS=Mus musculus OX=10090 GN=Hsp90aa1 PE=2 SV=1;sp|P07901|HS90A_MOUSE Heat shock ",44483000,43428000,38366000,36643000,35463000,37488000
"tr|Q91V38|Q91V38_MOUSE Heat shock protein 90, beta (Grp94), member 1 OS=Mus musculus OX=10090 GN=Hsp90b1 PE=2 SV=1;tr|Q3UBU0|Q3UBU0_MOUSE Uncharacterized protein OS=Mus musculus OX=10090 GN=Hsp90b1 PE=2 SV=1;tr|Q3UAD6|Q3UAD6_MOUSE Heat shock protein 90kDa ",14711000,16668000,14717000,10968000,8406600,13509000
tr|Q6GTX3|Q6GTX3_MOUSE Apoe protein OS=Mus musculus OX=10090 GN=Apoe PE=2 SV=1;tr|Q4FK40|Q4FK40_MOUSE Apoe protein OS=Mus musculus OX=10090 GN=Apoe PE=2 SV=1;tr|Q3UBS0|Q3UBS0_MOUSE Uncharacterized protein OS=Mus musculus OX=10090 GN=Apoe PE=2 SV=1;tr|Q3TXU,21537000,17441000,21984000,12905000,11516000,19871000
sp|P08228|SODC_MOUSE Superoxide dismutase [Cu-Zn] OS=Mus musculus OX=10090 GN=Sod1 PE=1 SV=2,3663600,1632300,3562700,891660,1012500,2033400
"sp|P08249|MDHM_MOUSE Malate dehydrogenase, mitochondrial OS=Mus musculus OX=10090 GN=Mdh2 PE=1 SV=3",128150000,140970000,94002000,113970000,115960000,94418000
tr|Q8BGR3|Q8BGR3_MOUSE Calcium/calmodulin-dependent protein kinase IV OS=Mus musculus OX=10090 GN=Camk4 PE=1 SV=1;sp|P08414|KCC4_MOUSE Calcium/calmodulin-dependent protein kinase type IV OS=Mus musculus OX=10090 GN=Camk4 PE=1 SV=2,3784600,3793200,4250600,2409700,2240100,4295500
tr|Q05DD2|Q05DD2_MOUSE Nefl protein (Fragment) OS=Mus musculus OX=10090 GN=Nefl PE=2 SV=1;sp|P08551|NFL_MOUSE Neurofilament light polypeptide OS=Mus musculus OX=10090 GN=Nefl PE=1 SV=5,30577000,45766000,37210000,32725000,25651000,40147000
sp|P08752|GNAI2_MOUSE Guanine nucleotide-binding protein G(i) subunit alpha-2 OS=Mus musculus OX=10090 GN=Gnai2 PE=1 SV=5;tr|A0A0A6YWA9|A0A0A6YWA9_MOUSE Guanine nucleotide-binding protein G(i) subunit alpha-2 (Fragment) OS=Mus musculus OX=10090 GN=Gnai2 PE,32697000,30972000,31702000,21066000,20252000,32326000
sp|P09055|ITB1_MOUSE Integrin beta-1 OS=Mus musculus OX=10090 GN=Itgb1 PE=1 SV=1,487650,387390,549550,330060,201510,533000
tr|Q3UDR2|Q3UDR2_MOUSE Protein disulfide-isomerase (Fragment) OS=Mus musculus OX=10090 GN=P4hb PE=2 SV=1;tr|Q3URP6|Q3URP6_MOUSE Protein disulfide-isomerase OS=Mus musculus OX=10090 GN=P4hb PE=2 SV=1;tr|Q3UJA8|Q3UJA8_MOUSE Protein disulfide-isomerase OS=Mus,9447900,11564000,10230000,7494900,6412500,8954100
sp|P09240|CCKN_MOUSE Cholecystokinin OS=Mus musculus OX=10090 GN=Cck PE=1 SV=3;tr|A0A1L1SU12|A0A1L1SU12_MOUSE Cholecystokinin (Fragment) OS=Mus musculus OX=10090 GN=Cck PE=4 SV=1;tr|A0A1L1SRD3|A0A1L1SRD3_MOUSE Cholecystokinin (Fragment) OS=Mus musculus OX=,1210100,1447400,1200300,935220,409930,1129200
tr|Q8CE30|Q8CE30_MOUSE Uncharacterized protein OS=Mus musculus OX=10090 GN=Ncl PE=2 SV=1;tr|Q8CD23|Q8CD23_MOUSE Uncharacterized protein OS=Mus musculus OX=10090 GN=Ncl PE=2 SV=1;tr|Q3TT41|Q3TT41_MOUSE Uncharacterized protein OS=Mus musculus OX=10090 GN=Ncl,609760,751070,592140,489240,438710,551480
sp|P09411|PGK1_MOUSE Phosphoglycerate kinase 1 OS=Mus musculus OX=10090 GN=Pgk1 PE=1 SV=4;tr|S4R2M7|S4R2M7_MOUSE Phosphoglycerate kinase OS=Mus musculus OX=10090 GN=Pgk1 PE=1 SV=1,120780000,138210000,99973000,106360000,90029000,104710000
sp|P09528|FRIH_MOUSE Ferritin heavy chain OS=Mus musculus OX=10090 GN=Fth1 PE=1 SV=2,10589000,7427400,13142000,9830500,3290200,7968500
"tr|Q4FJX9|Q4FJX9_MOUSE Superoxide dismutase OS=Mus musculus OX=10090 GN=Sod2 PE=1 SV=1;sp|P09671|SODM_MOUSE Superoxide dismutase [Mn], mitochondrial OS=Mus musculus OX=10090 GN=Sod2 PE=1 SV=3;tr|Q3U8W4|Q3U8W4_MOUSE Superoxide dismutase OS=Mus musculus OX=1",11205000,13010000,6923100,14662000,14620000,7775000
sp|P0C028|NUD11_MOUSE Diphosphoinositol polyphosphate phosphohydrolase 3-beta OS=Mus musculus OX=10090 GN=Nudt11 PE=1 SV=1;sp|P0C027|NUD10_MOUSE Diphosphoinositol polyphosphate phosphohydrolase 3-alpha OS=Mus musculus OX=10090 GN=Nudt10 PE=1 SV=1,225770,142980,225400,101700,121680,198330
sp|P0C7M9|CLC2L_MOUSE C-type lectin domain family 2 member L OS=Mus musculus OX=10090 GN=Clec2l PE=1 SV=1,262750,243910,281390,214450,156990,361840
sp|P0DN34|NDUB1_MOUSE NADH dehydrogenase [ubiquinone] 1 beta subcomplex subunit 1 OS=Mus musculus OX=10090 GN=Ndufb1 PE=3 SV=1,1256900,1088200,876610,1293800,795620,786700
sp|P0DP28|CALM3_MOUSE Calmodulin-3 OS=Mus musculus OX=10090 GN=Calm3 PE=1 SV=1;sp|P0DP27|CALM2_MOUSE Calmodulin-2 OS=Mus musculus OX=10090 GN=Calm2 PE=1 SV=1;sp|P0DP26|CALM1_MOUSE Calmodulin-1 OS=Mus musculus OX=10090 GN=Calm1 PE=1 SV=1;tr|Q3UKW2|Q3UKW2_MO,70519000,40375000,84778000,123240000,24574000,35056000
tr|Q58E64|Q58E64_MOUSE Elongation factor 1-alpha OS=Mus musculus OX=10090 GN=Eef1a1 PE=1 SV=1;tr|Q3UZQ3|Q3UZQ3_MOUSE Elongation factor 1-alpha OS=Mus musculus OX=10090 GN=Eef1a1 PE=2 SV=1;tr|Q3UA81|Q3UA81_MOUSE Elongation factor 1-alpha OS=Mus musculus OX=,17909000,7387000,11383000,13718000,12574000,10866000
tr|Q9DD05|Q9DD05_MOUSE Delta-aminolevulinic acid dehydratase OS=Mus musculus OX=10090 GN=Alad PE=2 SV=1;sp|P10518|HEM2_MOUSE Delta-aminolevulinic acid dehydratase OS=Mus musculus OX=10090 GN=Alad PE=1 SV=1;tr|Q8VCZ1|Q8VCZ1_MOUSE Alad protein OS=Mus musculu,215730,232170,352730,106820,121410,273010
tr|Q3TVS6|Q3TVS6_MOUSE Uncharacterized protein OS=Mus musculus OX=10090 GN=Ctsb PE=2 SV=1;tr|Q3TC17|Q3TC17_MOUSE Uncharacterized protein OS=Mus musculus OX=10090 GN=Ctsb PE=2 SV=1;sp|P10605|CATB_MOUSE Cathepsin B OS=Mus musculus OX=10090 GN=Ctsb PE=1 SV=2,1709500,1481200,2161800,1330800,873790,2781700
tr|Q52KC1|Q52KC1_MOUSE Eukaryotic translation initiation factor 4A2 OS=Mus musculus OX=10090 GN=Eif4a2 PE=2 SV=1;sp|P10630|IF4A2_MOUSE Eukaryotic initiation factor 4A-II OS=Mus musculus OX=10090 GN=Eif4a2 PE=1 SV=2;tr|E9Q561|E9Q561_MOUSE Eukaryotic initiat,1661100,2301000,1871300,1758600,1150800,2383800
sp|P10639|THIO_MOUSE Thioredoxin OS=Mus musculus OX=10090 GN=Txn PE=1 SV=3,2383400,1489700,1254000,2912700,3340000,966280
tr|Q3TN39|Q3TN39_MOUSE Uncharacterized protein OS=Mus musculus OX=10090 GN=Slc3a2 PE=2 SV=1;sp|P10852|4F2_MOUSE 4F2 cell-surface antigen heavy chain OS=Mus musculus OX=10090 GN=Slc3a2 PE=1 SV=1;tr|Q8BTJ9|Q8BTJ9_MOUSE Uncharacterized protein OS=Mus musculus,15478000,16916000,15139000,13339000,9833300,15672000
tr|Q8C1Y3|Q8C1Y3_MOUSE Uncharacterized protein OS=Mus musculus OX=10090 GN=H1f0 PE=2 SV=1;tr|Q3U4Y0|Q3U4Y0_MOUSE Uncharacterized protein OS=Mus musculus OX=10090 GN=H1f0 PE=2 SV=1;sp|P10922|H10_MOUSE Histone H1.0 OS=Mus musculus OX=10090 GN=H1f0 PE=2 SV=4,252350,333040,106220,235580,261050,78953
sp|P11031|TCP4_MOUSE Activated RNA polymerase II transcriptional coactivator p15 OS=Mus musculus OX=10090 GN=Sub1 PE=1 SV=3,2698800,2657400,2836100,2321400,1912000,3512800
tr|Q3UAX2|Q3UAX2_MOUSE Lipoprotein lipase OS=Mus musculus OX=10090 GN=Lpl PE=2 SV=1;tr|Q8C562|Q8C562_MOUSE Lipoprotein lipase OS=Mus musculus OX=10090 GN=Lpl PE=2 SV=1;tr|Q4FJQ8|Q4FJQ8_MOUSE Lipoprotein lipase OS=Mus musculus OX=10090 GN=Lpl PE=2 SV=1;tr|Q,376480,306280,161560,403380,327740,237440
"tr|Q5EBJ0|Q5EBJ0_MOUSE Fatty acid binding protein 3, muscle and heart OS=Mus musculus OX=10090 GN=Fabp3 PE=1 SV=1;sp|P11404|FABPH_MOUSE Fatty acid-binding protein, heart OS=Mus musculus OX=10090 GN=Fabp3 PE=1 SV=5",10352000,9172700,7258000,11313000,8897700,7815800
tr|Q922T9|Q922T9_MOUSE Lamp1 protein (Fragment) OS=Mus musculus OX=10090 GN=Lamp1 PE=2 SV=1;tr|Q8VH34|Q8VH34_MOUSE LAMP-1 OS=Mus musculus OX=10090 GN=Lamp1 PE=2 SV=1;tr|Q3TX84|Q3TX84_MOUSE Uncharacterized protein OS=Mus musculus OX=10090 GN=Lamp1 PE=2 SV=1,3200200,2185100,3601600,2150600,1628600,3080300
tr|Q71LX8|Q71LX8_MOUSE Heat shock protein 84b OS=Mus musculus OX=10090 GN=Hsp90ab1 PE=1 SV=1;sp|P11499|HS90B_MOUSE Heat shock protein HSP 90-beta OS=Mus musculus OX=10090 GN=Hsp90ab1 PE=1 SV=3;tr|Q811H6|Q811H6_MOUSE Hsp90ab1 protein (Fragment) OS=Mus muscu,126970000,126080000,112110000,99023000,95858000,100950000
"sp|P11881|ITPR1_MOUSE Inositol 1,4,5-trisphosphate receptor type 1 OS=Mus musculus OX=10090 GN=Itpr1 PE=1 SV=2;tr|Q8C7X9|Q8C7X9_MOUSE Uncharacterized protein OS=Mus musculus OX=10090 GN=Itpr1 PE=2 SV=1;tr|Q3UVA1|Q3UVA1_MOUSE Uncharacterized protein (Fragme",14514000,14593000,15440000,10263000,8631300,16002000
sp|P11983|TCPA_MOUSE T-complex protein 1 subunit alpha OS=Mus musculus OX=10090 GN=Tcp1 PE=1 SV=3,9538300,10221000,10672000,7208200,4915900,10847000
"sp|P12382|PFKAL_MOUSE ATP-dependent 6-phosphofructokinase, liver type OS=Mus musculus OX=10090 GN=Pfkl PE=1 SV=4;tr|Q8CD98|Q8CD98_MOUSE Uncharacterized protein OS=Mus musculus OX=10090 GN=Pfkl PE=2 SV=1",13754000,12927000,13675000,9468000,7245600,14114000
tr|Q8CEF3|Q8CEF3_MOUSE Uncharacterized protein OS=Mus musculus OX=10090 GN=Calb1 PE=2 SV=1;tr|Q8C5H2|Q8C5H2_MOUSE Uncharacterized protein OS=Mus musculus OX=10090 GN=Calb1 PE=2 SV=1;sp|P12658|CALB1_MOUSE Calbindin OS=Mus musculus OX=10090 GN=Calb1 PE=1 SV=,12331000,11225000,13339000,7726000,5724800,9738500
"sp|P12787|COX5A_MOUSE Cytochrome c oxidase subunit 5A, mitochondrial OS=Mus musculus OX=10090 GN=Cox5a PE=1 SV=2",46572000,41251000,50791000,46102000,20910000,28033000
"tr|Q8C5M4|Q8C5M4_MOUSE Uncharacterized protein OS=Mus musculus OX=10090 GN=Pdcd6 PE=2 SV=1;sp|P12815|PDCD6_MOUSE Programmed cell death protein 6 OS=Mus musculus OX=10090 GN=Pdcd6 PE=1 SV=2;tr|Q3UGE5|Q3UGE5_MOUSE Programmed cell death 6, isoform CRA_a OS=Mu",4289100,4364400,4323700,2953000,2701200,3718400
sp|P12960|CNTN1_MOUSE Contactin-1 OS=Mus musculus OX=10090 GN=Cntn1 PE=1 SV=1,71195000,53286000,59661000,42699000,23940000,58708000
"tr|Q6PAC1|Q6PAC1_MOUSE Gelsolin, isoform CRA_c OS=Mus musculus OX=10090 GN=Gsn PE=2 SV=1;tr|Q3UCW8|Q3UCW8_MOUSE Uncharacterized protein OS=Mus musculus OX=10090 GN=Gsn PE=2 SV=1;tr|Q3TGJ9|Q3TGJ9_MOUSE Uncharacterized protein OS=Mus musculus OX=10090 GN=Gsn",5831800,6742300,7022100,5296900,3594700,7511400
tr|Q545P0|Q545P0_MOUSE Sodium/potassium-transporting ATPase subunit beta OS=Mus musculus OX=10090 GN=Atp1b1 PE=1 SV=1;tr|Q3TV47|Q3TV47_MOUSE Sodium/potassium-transporting ATPase subunit beta OS=Mus musculus OX=10090 GN=Atp1b1 PE=2 SV=1;tr|Q3TSQ1|Q3TSQ1_MOU,45679000,43643000,24901000,48454000,56274000,28611000
tr|Q3US82|Q3US82_MOUSE Uncharacterized protein OS=Mus musculus OX=10090 GN=C1qb PE=2 SV=1;tr|Q3U6I5|Q3U6I5_MOUSE Uncharacterized protein OS=Mus musculus OX=10090 GN=C1qb PE=2 SV=1;sp|P14106|C1QB_MOUSE Complement C1q subcomponent subunit B OS=Mus musculus O,1535000,1316400,1416200,1067500,614940,1345600
sp|P14115|RL27A_MOUSE 60S ribosomal protein L27a OS=Mus musculus OX=10090 GN=Rpl27a PE=1 SV=5,4110500,4126200,3438300,2991900,1800300,4032700
tr|Q5M9N8|Q5M9N8_MOUSE Ribosomal protein L7 OS=Mus musculus OX=10090 GN=Rpl7 PE=1 SV=1;tr|Q3UBI6|Q3UBI6_MOUSE Uncharacterized protein OS=Mus musculus OX=10090 GN=Rpl7 PE=2 SV=1;sp|P14148|RL7_MOUSE 60S ribosomal protein L7 OS=Mus musculus OX=10090 GN=Rpl7 P,9277200,9259400,6573100,7401200,3973300,7196700
"sp|P14152|MDHC_MOUSE Malate dehydrogenase, cytoplasmic OS=Mus musculus OX=10090 GN=Mdh1 PE=1 SV=3",97988000,100240000,97337000,74639000,75663000,101220000
tr|Q3UR55|Q3UR55_MOUSE Sodium/potassium-transporting ATPase subunit beta OS=Mus musculus OX=10090 GN=Atp1b2 PE=1 SV=1;sp|P14231|AT1B2_MOUSE Sodium/potassium-transporting ATPase subunit beta-2 OS=Mus musculus OX=10090 GN=Atp1b2 PE=1 SV=2;tr|I7HIF3|I7HIF3_MO,8168600,6133900,8591000,6820700,4551300,7519400
tr|Q8BK46|Q8BK46_MOUSE Uncharacterized protein OS=Mus musculus OX=10090 GN=Psmd3 PE=2 SV=1;tr|Q3ULJ5|Q3ULJ5_MOUSE Uncharacterized protein OS=Mus musculus OX=10090 GN=Psmd3 PE=2 SV=1;tr|Q3U5M8|Q3U5M8_MOUSE Uncharacterized protein OS=Mus musculus OX=10090 GN,1782800,1645300,1775300,1416600,956570,1793300
tr|Q3UI56|Q3UI56_MOUSE Annexin OS=Mus musculus OX=10090 GN=Anxa6 PE=2 SV=1;sp|P14824|ANXA6_MOUSE Annexin A6 OS=Mus musculus OX=10090 GN=Anxa6 PE=1 SV=3;tr|Q99JX6|Q99JX6_MOUSE Annexin OS=Mus musculus OX=10090 GN=Anxa6 PE=2 SV=1;tr|Q3TUI1|Q3TUI1_MOUSE Annexi,15781000,17983000,17658000,12617000,10145000,17360000
sp|P14873|MAP1B_MOUSE Microtubule-associated protein 1B OS=Mus musculus OX=10090 GN=Map1b PE=1 SV=2;tr|B2RQQ5|B2RQQ5_MOUSE Microtubule-associated protein 1B OS=Mus musculus OX=10090 GN=Map1b PE=2 SV=1,17443000,17732000,15483000,14410000,10663000,14677000
sp|P15105|GLNA_MOUSE Glutamine synthetase OS=Mus musculus OX=10090 GN=Glul PE=1 SV=6;tr|D3YVK1|D3YVK1_MOUSE Glutamine synthetase (Fragment) OS=Mus musculus OX=10090 GN=Glul PE=1 SV=8;tr|V9GZG5|V9GZG5_MOUSE Glutamine synthetase OS=Mus musculus OX=10090 PE=3,126020000,118760000,130340000,103720000,89038000,140240000
sp|P15209|NTRK2_MOUSE BDNF/NT-3 growth factors receptor OS=Mus musculus OX=10090 GN=Ntrk2 PE=1 SV=1,2411000,2568200,2515500,2158700,1268400,3022100
tr|Q5NC81|Q5NC81_MOUSE Nucleoside diphosphate kinase OS=Mus musculus OX=10090 GN=Nme1 PE=1 SV=1;sp|P15532|NDKA_MOUSE Nucleoside diphosphate kinase A OS=Mus musculus OX=10090 GN=Nme1 PE=1 SV=1;tr|Q5NC80|Q5NC80_MOUSE Nucleoside diphosphate kinase (Fragment) ,23867000,21108000,19216000,18100000,17992000,16706000
sp|P16045|LEG1_MOUSE Galectin-1 OS=Mus musculus OX=10090 GN=Lgals1 PE=1 SV=3,647720,840570,727310,547380,288200,762730
sp|P16054|KPCE_MOUSE Protein kinase C epsilon type OS=Mus musculus OX=10090 GN=Prkce PE=1 SV=1,7490800,7438500,6766400,5220600,4051500,7416700
sp|P16125|LDHB_MOUSE L-lactate dehydrogenase B chain OS=Mus musculus OX=10090 GN=Ldhb PE=1 SV=2;tr|Q5M8R7|Q5M8R7_MOUSE Ldhb protein OS=Mus musculus OX=10090 GN=Ldhb PE=2 SV=1;tr|D3Z7F0|D3Z7F0_MOUSE L-lactate dehydrogenase (Fragment) OS=Mus musculus OX=1009,27755000,26005000,14844000,31742000,31974000,16012000
"tr|Q3TYV5|Q3TYV5_MOUSE 2,3-cyclic-nucleotide 3-phosphodiesterase OS=Mus musculus OX=10090 GN=Cnp PE=2 SV=1;sp|P16330|CN37_MOUSE 2,3-cyclic-nucleotide 3-phosphodiesterase OS=Mus musculus OX=10090 GN=Cnp PE=1 SV=3;tr|Q3TYL9|Q3TYL9_MOUSE 2,3-cyclic-nu",85891000,106680000,77591000,87542000,94572000,82655000
"tr|Q3TZ64|Q3TZ64_MOUSE Uncharacterized protein (Fragment) OS=Mus musculus OX=10090 GN=Kcna1 PE=2 SV=1;tr|Q8CA58|Q8CA58_MOUSE Uncharacterized protein OS=Mus musculus OX=10090 GN=Kcna1 PE=2 SV=1;tr|Q2KHP0|Q2KHP0_MOUSE Potassium voltage-gated channel, shaker-",118900,90504,102740,116030,46684,183610
tr|Q3UJ34|Q3UJ34_MOUSE MCG19004 OS=Mus musculus OX=10090 GN=Ass1 PE=1 SV=1;tr|Q3UEJ7|Q3UEJ7_MOUSE Uncharacterized protein OS=Mus musculus OX=10090 GN=Ass1 PE=2 SV=1;sp|P16460|ASSY_MOUSE Argininosuccinate synthase OS=Mus musculus OX=10090 GN=Ass1 PE=1 SV=1,7766200,6590000,6507400,5016400,5640700,5123200
