Fasta headers,Reporter intensity corrected 0,Reporter intensity corrected 1,Reporter intensity corrected 2,Reporter intensity corrected 3,Reporter intensity corrected 4,Reporter intensity corrected 5
"tr|B1AU25|B1AU25_MOUSE Apoptosis-inducing factor 1, mitochondrial OS=Mus musculus OX=10090 GN=Aifm1 PE=1 SV=1;sp|Q9Z0X1|AIFM1_MOUSE Apoptosis-inducing factor 1, mitochondrial OS=Mus musculus OX=10090 GN=Aifm1 PE=1 SV=1;tr|Q2QKE3|Q2QKE3_MOUSE Apoptosis-indu",4330100,4553400,4328800,4730600,3554100,4945500
tr|B1AUX2|B1AUX2_MOUSE Host cell factor 1 OS=Mus musculus OX=10090 GN=Hcfc1 PE=1 SV=1;sp|Q61191|HCFC1_MOUSE Host cell factor 1 OS=Mus musculus OX=10090 GN=Hcfc1 PE=1 SV=2;tr|Q3USQ6|Q3USQ6_MOUSE Uncharacterized protein (Fragment) OS=Mus musculus OX=10090 GN,59179,52877,45212,66293,40757,55436
tr|B1AUY8|B1AUY8_MOUSE N-alpha-acetyltransferase 10 OS=Mus musculus OX=10090 GN=Naa10 PE=1 SV=1;tr|Q684Q8|Q684Q8_MOUSE N-terminal acetyltransferase complex ARD1 subunit homolog (Fragment) OS=Mus musculus OX=10090 GN=Naa10 PE=2 SV=1;tr|B1AUY7|B1AUY7_MOUSE N,214360,170310,227410,124280,101130,237290
tr|B1AV66|B1AV66_MOUSE Protein YIPF (Fragment) OS=Mus musculus OX=10090 GN=Yipf6 PE=1 SV=1;sp|Q8BR70|YIPF6_MOUSE Protein YIPF6 OS=Mus musculus OX=10090 GN=Yipf6 PE=1 SV=1,6132.3,7248,14921,5506.8,4379,5134.4
"tr|Q8CAB3|Q8CAB3_MOUSE Gamma-aminobutyric acid (GABA-A) receptor, subunit alpha 3 OS=Mus musculus OX=10090 GN=Gabra3 PE=2 SV=1;tr|B1AVY2|B1AVY2_MOUSE Gamma-aminobutyric acid receptor subunit alpha-3 OS=Mus musculus OX=10090 GN=Gabra3 PE=1 SV=1;sp|P26049|GB",253300,222340,252560,251290,128800,295200
tr|B1AW58|B1AW58_MOUSE Calcium/calmodulin-dependent protein kinase ID OS=Mus musculus OX=10090 GN=Camk1d PE=2 SV=1;sp|Q8BW96|KCC1D_MOUSE Calcium/calmodulin-dependent protein kinase type 1D OS=Mus musculus OX=10090 GN=Camk1d PE=1 SV=2;tr|Q3TDM2|Q3TDM2_MOUSE,360380,298670,353350,182520,225810,443670
"tr|G3UZ46|G3UZ46_MOUSE Phosphodiesterase 4B, cAMP-specific OS=Mus musculus OX=10090 GN=Pde4b PE=1 SV=1;tr|Q80VK8|Q80VK8_MOUSE Pde4b protein OS=Mus musculus OX=10090 GN=Pde4b PE=1 SV=1;tr|B1AWC8|B1AWC8_MOUSE Phosphodiesterase OS=Mus musculus OX=10090 GN=Pde",449120,548880,434440,328190,268920,381490
tr|B1AWD8|B1AWD8_MOUSE Clathrin light chain OS=Mus musculus OX=10090 GN=Clta PE=1 SV=1;tr|B1AWD9|B1AWD9_MOUSE Clathrin light chain OS=Mus musculus OX=10090 GN=Clta PE=1 SV=1;sp|O08585|CLCA_MOUSE Clathrin light chain A OS=Mus musculus OX=10090 GN=Clta PE=1 ,2515600,1727900,1432900,3759800,2740400,763950
tr|B1AWE0|B1AWE0_MOUSE Clathrin light chain OS=Mus musculus OX=10090 GN=Clta PE=1 SV=1;tr|Q6PFA2|Q6PFA2_MOUSE Clathrin light chain OS=Mus musculus OX=10090 GN=Clta PE=1 SV=1;tr|Q3THU7|Q3THU7_MOUSE Clathrin light chain OS=Mus musculus OX=10090 GN=Clta PE=2 ,35689000,28928000,37905000,29336000,15196000,26492000
"tr|B1AWT4|B1AWT4_MOUSE Ras-related GTP-binding protein D OS=Mus musculus OX=10090 GN=Rragd PE=1 SV=1;tr|B1AWT2|B1AWT2_MOUSE Ras-related GTP binding D, isoform CRA_a OS=Mus musculus OX=10090 GN=Rragd PE=1 SV=1;tr|B1AWT3|B1AWT3_MOUSE Ras-related GTP-binding ",64243,15522,71493,28845,24904,46668
tr|J7K287|J7K287_MOUSE Anion exchange protein OS=Mus musculus OX=10090 GN=Slc4a10 PE=2 SV=1;tr|G3F8Y7|G3F8Y7_MOUSE Anion exchange protein OS=Mus musculus OX=10090 GN=Slc4a10 PE=2 SV=1;tr|Q8C943|Q8C943_MOUSE Anion exchange protein (Fragment) OS=Mus musculus,3881900,3436500,4447700,4245100,2107900,6814300
tr|B1AX98|B1AX98_MOUSE Leucine rich repeat containing 47 OS=Mus musculus OX=10090 GN=Lrrc47 PE=1 SV=1;sp|Q505F5|LRC47_MOUSE Leucine-rich repeat-containing protein 47 OS=Mus musculus OX=10090 GN=Lrrc47 PE=1 SV=1;tr|E9PV22|E9PV22_MOUSE Leucine-rich repeat-co,1523000,1915800,1386800,1323700,864930,1608100
tr|B1AXI9|B1AXI9_MOUSE 5-azacytidine induced gene 1 OS=Mus musculus OX=10090 GN=Cep131 PE=1 SV=1;tr|J3QMP9|J3QMP9_MOUSE Centrosomal protein of 131 kDa OS=Mus musculus OX=10090 GN=Cep131 PE=1 SV=1;sp|Q62036|CP131_MOUSE Centrosomal protein of 131 kDa OS=Mus ,46870,4934,51495,38695,0,63779
sp|B1AXV0|FRS1L_MOUSE DOMON domain-containing protein FRRS1L OS=Mus musculus OX=10090 GN=Frrs1l PE=1 SV=1;tr|Q8BVG0|Q8BVG0_MOUSE Uncharacterized protein (Fragment) OS=Mus musculus OX=10090 GN=Frrs1l PE=2 SV=1,324960,407980,340850,275000,169160,410000
tr|B1AXW5|B1AXW5_MOUSE Peroxiredoxin-1 (Fragment) OS=Mus musculus OX=10090 GN=Prdx1 PE=1 SV=8;tr|B1AXW6|B1AXW6_MOUSE Peroxiredoxin-1 (Fragment) OS=Mus musculus OX=10090 GN=Prdx1 PE=1 SV=1;tr|Q3U9J9|Q3U9J9_MOUSE Uncharacterized protein OS=Mus musculus OX=10,31731000,29067000,30309000,21169000,18640000,28962000
tr|B1AXY0|B1AXY0_MOUSE DnaJ homolog subfamily A member 1 (Fragment) OS=Mus musculus OX=10090 GN=Dnaja1 PE=1 SV=1;tr|B1AXY1|B1AXY1_MOUSE DnaJ homolog subfamily A member 1 (Fragment) OS=Mus musculus OX=10090 GN=Dnaja1 PE=1 SV=1;tr|Q5NTY0|Q5NTY0_MOUSE DnaJ (H,2227300,1930000,2644200,782810,1075300,2736500
tr|B7ZNS2|B7ZNS2_MOUSE Disks large-associated protein 4 OS=Mus musculus OX=10090 GN=Dlgap4 PE=1 SV=1;sp|B1AZP2|DLGP4_MOUSE Disks large-associated protein 4 OS=Mus musculus OX=10090 GN=Dlgap4 PE=1 SV=1;tr|H3BJW9|H3BJW9_MOUSE Disks large-associated protein 4,931480,1079500,802740,818160,490440,884070
tr|B1AZS9|B1AZS9_MOUSE Peroxiredoxin-4 (Fragment) OS=Mus musculus OX=10090 GN=Prdx4 PE=1 SV=1;sp|O08807|PRDX4_MOUSE Peroxiredoxin-4 OS=Mus musculus OX=10090 GN=Prdx4 PE=1 SV=1,13864000,11628000,13303000,8730700,6429100,13415000
"tr|B1B1A8|B1B1A8_MOUSE Myosin light chain kinase, smooth muscle OS=Mus musculus OX=10090 GN=Mylk PE=1 SV=1;sp|Q6PDN3|MYLK_MOUSE Myosin light chain kinase, smooth muscle OS=Mus musculus OX=10090 GN=Mylk PE=1 SV=3",898500,995680,858840,825640,561300,931600
tr|B1GX80|B1GX80_MOUSE Non-specific serine/threonine protein kinase OS=Mus musculus OX=10090 GN=Pak3 PE=2 SV=1;tr|B1GX81|B1GX81_MOUSE PAK3cb protein OS=Mus musculus OX=10090 GN=Pak3 PE=2 SV=1;sp|Q61036|PAK3_MOUSE Serine/threonine-protein kinase PAK 3 OS=Mu,765380,823590,765160,495350,475400,657580
tr|E9QMC2|E9QMC2_MOUSE Metabotropic glutamate receptor 5 OS=Mus musculus OX=10090 GN=Grm5 PE=1 SV=1;tr|B2BH30|B2BH30_MOUSE Metabotropic glutamate receptor subtype 5b OS=Mus musculus OX=10090 GN=Grm5 PE=1 SV=1;sp|Q3UVX5|GRM5_MOUSE Metabotropic glutamate rec,3855800,4370000,3481900,2830700,2621900,3495300
tr|B2CY77|B2CY77_MOUSE Laminin receptor (Fragment) OS=Mus musculus OX=10090 GN=Rpsa PE=2 SV=1;sp|P14206|RSSA_MOUSE 40S ribosomal protein SA OS=Mus musculus OX=10090 GN=Rpsa PE=1 SV=4;tr|A0A1L1SRW0|A0A1L1SRW0_MOUSE 40S ribosomal protein SA (Fragment) OS=Mus,12978000,15099000,12631000,11608000,6258200,13948000
tr|B2KGP3|B2KGP3_MOUSE Protein phosphatase 1E (PP2C domain containing) OS=Mus musculus OX=10090 GN=Ppm1e PE=1 SV=1;sp|Q80TL0|PPM1E_MOUSE Protein phosphatase 1E OS=Mus musculus OX=10090 GN=Ppm1e PE=1 SV=2,1183200,777780,1231900,817750,526840,1521600
tr|Q4W4C9|Q4W4C9_MOUSE Neural visinin-like type 1 protein OS=Mus musculus OX=10090 GN=Vsnl1 PE=1 SV=1;tr|Q3TVC0|Q3TVC0_MOUSE Uncharacterized protein OS=Mus musculus OX=10090 GN=Vsnl1 PE=2 SV=1;tr|B2L107|B2L107_MOUSE Visinin-like protein 1 OS=Mus musculus O,27803000,20727000,24467000,28607000,19398000,26951000
tr|Q3TDM8|Q3TDM8_MOUSE Secretory carrier-associated membrane protein OS=Mus musculus OX=10090 GN=Scamp3 PE=2 SV=1;tr|E9Q855|E9Q855_MOUSE Secretory carrier-associated membrane protein OS=Mus musculus OX=10090 GN=Scamp3 PE=1 SV=1;tr|Q3UK26|Q3UK26_MOUSE Secre,444210,519500,407640,388350,289770,419760
tr|B2M1R6|B2M1R6_MOUSE Heterogeneous nuclear ribonucleoprotein K OS=Mus musculus OX=10090 GN=Hnrnpk PE=1 SV=1;tr|Q3U9Q3|Q3U9Q3_MOUSE Uncharacterized protein OS=Mus musculus OX=10090 GN=Hnrnpk PE=2 SV=1;tr|Q3U6X2|Q3U6X2_MOUSE Uncharacterized protein OS=Mus ,19960000,21299000,18365000,12852000,10960000,19920000
tr|Q3TT81|Q3TT81_MOUSE Uncharacterized protein OS=Mus musculus OX=10090 GN=Pcbp2 PE=2 SV=1;tr|B2M1R7|B2M1R7_MOUSE Poly(RC) binding protein 2 OS=Mus musculus OX=10090 GN=Pcbp2 PE=2 SV=1;sp|Q61990|PCBP2_MOUSE Poly(rC)-binding protein 2 OS=Mus musculus OX=100,1004400,1160100,906670,925500,747530,1052100
tr|Q3UWP8|Q3UWP8_MOUSE Uncharacterized protein (Fragment) OS=Mus musculus OX=10090 GN=Calr PE=2 SV=1;tr|B2MWM9|B2MWM9_MOUSE Calreticulin OS=Mus musculus OX=10090 GN=Calr PE=1 SV=1;sp|P14211|CALR_MOUSE Calreticulin OS=Mus musculus OX=10090 GN=Calr PE=1 SV=1,33667000,31872000,34158000,24528000,18565000,36075000
"tr|B2RPS1|B2RPS1_MOUSE RAB5B, member RAS oncogene family OS=Mus musculus OX=10090 GN=Rab5b PE=1 SV=1;tr|Q0PD56|Q0PD56_MOUSE Rab5B OS=Mus musculus OX=10090 GN=Rab5b PE=2 SV=1;sp|P61021|RAB5B_MOUSE Ras-related protein Rab-5B OS=Mus musculus OX=10090 GN=Rab5b",1373000,1551000,1541600,1086000,742900,1810800
"tr|D3Z5B1|D3Z5B1_MOUSE Zinc finger, BED type-containing 5 (Fragment) OS=Mus musculus OX=10090 GN=Zbed5 PE=4 SV=8;tr|Q8CEW7|Q8CEW7_MOUSE Uncharacterized protein OS=Mus musculus OX=10090 GN=Zbed5 PE=2 SV=1;tr|B2RPU8|B2RPU8_MOUSE MCG130675 OS=Mus musculus OX=",1024900,831270,939980,662090,488540,818390
"tr|B2RPW2|B2RPW2_MOUSE Smith-Magenis syndrome chromosome region, candidate 7-like (Human) OS=Mus musculus OX=10090 GN=Mief1 PE=1 SV=1;sp|Q8BGV8|MID51_MOUSE Mitochondrial dynamics protein MID51 OS=Mus musculus OX=10090 GN=Mief1 PE=1 SV=1",168570,182950,162270,138300,124210,194800
tr|B7ZMZ7|B7ZMZ7_MOUSE Dip2c protein OS=Mus musculus OX=10090 GN=Dip2c PE=1 SV=1;tr|B2RQ71|B2RQ71_MOUSE Dip2c protein OS=Mus musculus OX=10090 GN=Dip2c PE=1 SV=1;tr|Q69ZV2|Q69ZV2_MOUSE MKIAA0934 protein (Fragment) OS=Mus musculus OX=10090 GN=Dip2c PE=2 SV=,159650,210500,163190,141680,106710,190040
tr|E0CXD6|E0CXD6_MOUSE Traf2 and NCK-interacting protein kinase OS=Mus musculus OX=10090 GN=Tnik PE=1 SV=1;tr|E0CY98|E0CY98_MOUSE Traf2 and NCK-interacting protein kinase OS=Mus musculus OX=10090 GN=Tnik PE=1 SV=1;tr|B9EKN8|B9EKN8_MOUSE TRAF2 and NCK inter,4069900,4593800,3170100,2754100,1889000,4002500
tr|B2RQE5|B2RQE5_MOUSE Syntaxin binding protein 5-like OS=Mus musculus OX=10090 GN=Stxbp5l PE=2 SV=1;tr|B7ZN50|B7ZN50_MOUSE Stxbp5l protein OS=Mus musculus OX=10090 GN=Stxbp5l PE=2 SV=1,119650,149490,121020,91828,66848,164630
tr|B2RQQ7|B2RQQ7_MOUSE CDC42 binding protein kinase beta OS=Mus musculus OX=10090 GN=Cdc42bpb PE=2 SV=1;sp|Q7TT50|MRCKB_MOUSE Serine/threonine-protein kinase MRCK beta OS=Mus musculus OX=10090 GN=Cdc42bpb PE=1 SV=2,0,0,0,0,0,0
tr|Q3TDT4|Q3TDT4_MOUSE Uncharacterized protein (Fragment) OS=Mus musculus OX=10090 GN=Sgsm1 PE=2 SV=1;tr|B2RQR5|B2RQR5_MOUSE Small G protein signaling modulator 1 OS=Mus musculus OX=10090 GN=Sgsm1 PE=1 SV=1;sp|Q8BPQ7|SGSM1_MOUSE Small G protein signaling m,958240,1182500,903110,597030,504490,776120
tr|B2RQS1|B2RQS1_MOUSE Striatin-3 OS=Mus musculus OX=10090 GN=Strn3 PE=1 SV=1;sp|Q9ERG2|STRN3_MOUSE Striatin-3 OS=Mus musculus OX=10090 GN=Strn3 PE=1 SV=1;tr|Q3TNV4|Q3TNV4_MOUSE Uncharacterized protein (Fragment) OS=Mus musculus OX=10090 GN=Strn3 PE=2 SV=1,1366100,1319300,1396500,1117500,870300,1376400
tr|B2RQZ6|B2RQZ6_MOUSE GPRIN family member 3 OS=Mus musculus OX=10090 GN=Gprin3 PE=1 SV=1;sp|Q8BWS5|GRIN3_MOUSE G protein-regulated inducer of neurite outgrowth 3 OS=Mus musculus OX=10090 GN=Gprin3 PE=1 SV=1,261530,279690,278880,155730,152780,140460
tr|Q8C1S8|Q8C1S8_MOUSE Uncharacterized protein OS=Mus musculus OX=10090 GN=Nhlrc2 PE=2 SV=1;tr|B2RR26|B2RR26_MOUSE NHL repeat containing 2 OS=Mus musculus OX=10090 GN=Nhlrc2 PE=1 SV=1;tr|Q9CW64|Q9CW64_MOUSE Uncharacterized protein (Fragment) OS=Mus musculu,101490,122050,130100,91883,55065,119930
tr|K3W4L0|K3W4L0_MOUSE Unconventional myosin-XVIIIa OS=Mus musculus OX=10090 GN=Myo18a PE=1 SV=1;tr|B2RRE2|B2RRE2_MOUSE Myo18a protein OS=Mus musculus OX=10090 GN=Myo18a PE=1 SV=1;tr|E9QAX2|E9QAX2_MOUSE Unconventional myosin-XVIIIa OS=Mus musculus OX=10090,5419300,5405600,5207100,4330800,2682200,6248200
tr|B2RRH9|B2RRH9_MOUSE Guanine monphosphate synthetase OS=Mus musculus OX=10090 GN=Gmps PE=1 SV=1;sp|Q3THK7|GUAA_MOUSE GMP synthase [glutamine-hydrolyzing] OS=Mus musculus OX=10090 GN=Gmps PE=1 SV=2,4852900,5053300,4468600,3561400,2869500,5106100
tr|E9PUD0|E9PUD0_MOUSE Zinc finger Ran-binding domain-containing protein 2 OS=Mus musculus OX=10090 GN=Zranb2 PE=1 SV=1;tr|D3Z4U0|D3Z4U0_MOUSE Zinc finger Ran-binding domain-containing protein 2 OS=Mus musculus OX=10090 GN=Zranb2 PE=1 SV=2;tr|B2RRT9|B2RRT9,234340,273710,166250,203650,124670,222300
tr|Q3UAF7|Q3UAF7_MOUSE Uncharacterized protein OS=Mus musculus OX=10090 GN=Actb PE=2 SV=1;tr|Q3UAF6|Q3UAF6_MOUSE Uncharacterized protein OS=Mus musculus OX=10090 GN=Actb PE=2 SV=1;tr|Q3U5R4|Q3U5R4_MOUSE Uncharacterized protein OS=Mus musculus OX=10090 GN=A,216660000,229770000,164260000,176970000,199260000,174560000
tr|B2RRX2|B2RRX2_MOUSE Serine/threonine-protein phosphatase OS=Mus musculus OX=10090 GN=Ppp3ca PE=2 SV=1;sp|P63328|PP2BA_MOUSE Serine/threonine-protein phosphatase 2B catalytic subunit alpha isoform OS=Mus musculus OX=10090 GN=Ppp3ca PE=1 SV=1,61551000,58497000,57436000,47258000,45763000,59328000
tr|B2RRY8|B2RRY8_MOUSE Hippocalcin-like 4 OS=Mus musculus OX=10090 GN=Hpcal4 PE=1 SV=1;sp|Q8BGZ1|HPCL4_MOUSE Hippocalcin-like protein 4 OS=Mus musculus OX=10090 GN=Hpcal4 PE=1 SV=3;tr|F2Z3Z1|F2Z3Z1_MOUSE Hippocalcin-like protein 4 (Fragment) OS=Mus musculu,4612400,4506500,3840100,3486300,2658000,4190100
tr|B2RS27|B2RS27_MOUSE RAS protein-specific guanine nucleotide-releasing factor 1 OS=Mus musculus OX=10090 GN=Rasgrf1 PE=1 SV=1;sp|P27671|RGRF1_MOUSE Ras-specific guanine nucleotide-releasing factor 1 OS=Mus musculus OX=10090 GN=Rasgrf1 PE=1 SV=2;tr|Q9QYS5,738640,543270,702360,526530,402070,848610
"tr|B2RS41|B2RS41_MOUSE Aldhehyde dehydrogenase family 5, subfamily A1 OS=Mus musculus OX=10090 GN=Aldh5a1 PE=1 SV=1;sp|Q8BWF0|SSDH_MOUSE Succinate-semialdehyde dehydrogenase, mitochondrial OS=Mus musculus OX=10090 GN=Aldh5a1 PE=1 SV=1",40534000,42684000,38927000,25328000,23129000,29664000
tr|B2RSC8|B2RSC8_MOUSE E3 ubiquitin-protein ligase OS=Mus musculus OX=10090 GN=Nedd4 PE=1 SV=1;sp|P46935|NEDD4_MOUSE E3 ubiquitin-protein ligase NEDD4 OS=Mus musculus OX=10090 GN=Nedd4 PE=1 SV=3;tr|Q3TUU1|Q3TUU1_MOUSE Uncharacterized protein OS=Mus musculu,1182200,642850,978190,751140,675970,1065800
sp|B2RSH2|GNAI1_MOUSE Guanine nucleotide-binding protein G(i) subunit alpha-1 OS=Mus musculus OX=10090 GN=Gnai1 PE=1 SV=1,7595300,6275300,5611900,5495100,5248700,6711900
tr|B2RSN3|B2RSN3_MOUSE Tubulin beta chain OS=Mus musculus OX=10090 GN=Tubb2b PE=1 SV=1;sp|Q9CWF2|TBB2B_MOUSE Tubulin beta-2B chain OS=Mus musculus OX=10090 GN=Tubb2b PE=1 SV=1;tr|Q99J49|Q99J49_MOUSE Tubb2a protein (Fragment) OS=Mus musculus OX=10090 GN=Tub,155940,187050,78658,249910,359150,67437
tr|B2RSR7|B2RSR7_MOUSE Glycerol-3-phosphate dehydrogenase [NAD(+)] OS=Mus musculus OX=10090 GN=Gpd1l PE=2 SV=1;sp|Q3ULJ0|GPD1L_MOUSE Glycerol-3-phosphate dehydrogenase 1-like protein OS=Mus musculus OX=10090 GN=Gpd1l PE=1 SV=2,17947000,18423000,16754000,14648000,10661000,18822000
tr|B2RSY3|B2RSY3_MOUSE Hepatocyte cell adhesion molecule OS=Mus musculus OX=10090 GN=Hepacam PE=1 SV=1;sp|Q640R3|HECAM_MOUSE Hepatocyte cell adhesion molecule OS=Mus musculus OX=10090 GN=Hepacam PE=1 SV=2,19980,17990,2430.4,12098,27750,5035.4
"tr|E9Q5I9|E9Q5I9_MOUSE 26S proteasome non-ATPase regulatory subunit 13 OS=Mus musculus OX=10090 GN=Psmd13 PE=1 SV=1;tr|B2RT97|B2RT97_MOUSE Proteasome (Prosome, macropain) 26S subunit, non-ATPase, 13 OS=Mus musculus OX=10090 GN=Psmd13 PE=1 SV=1;sp|Q9WVJ2|PS",1448300,1267900,1530000,1055700,964420,1731200
tr|Q1WWJ8|Q1WWJ8_MOUSE Pdap1 protein (Fragment) OS=Mus musculus OX=10090 GN=Pdap1 PE=2 SV=1;tr|B2RTB0|B2RTB0_MOUSE MCG17262 OS=Mus musculus OX=10090 GN=Pdap1 PE=1 SV=1;sp|Q3UHX2|HAP28_MOUSE 28 kDa heat- and acid-stable phosphoprotein OS=Mus musculus OX=100,279850,377580,243300,206040,139610,310710
"tr|B2RTE8|B2RTE8_MOUSE RIKEN cDNA 2610039E05, isoform CRA_a OS=Mus musculus OX=10090 GN=Spata2l PE=2 SV=1;sp|Q8BNN1|SPA2L_MOUSE Spermatogenesis-associated protein 2-like protein OS=Mus musculus OX=10090 GN=Spata2l PE=1 SV=1",862620,677380,837430,373020,419590,600650
tr|B2RTG7|B2RTG7_MOUSE WD repeat domain 26 OS=Mus musculus OX=10090 GN=Wdr26 PE=2 SV=1;tr|E0CYH4|E0CYH4_MOUSE WD repeat-containing protein 26 OS=Mus musculus OX=10090 GN=Wdr26 PE=1 SV=1;sp|Q8C6G8|WDR26_MOUSE WD repeat-containing protein 26 OS=Mus musculus ,2126800,2229800,2151800,1738700,1150200,2501600
tr|O70285|O70285_MOUSE Cyclic AMP specific phosphodiesterase PDE4A5A (Fragment) OS=Mus musculus OX=10090 GN=Pde4a PE=2 SV=1;tr|Q3TUD0|Q3TUD0_MOUSE Phosphodiesterase (Fragment) OS=Mus musculus OX=10090 GN=Pde4a PE=2 SV=1;tr|B2RTL2|B2RTL2_MOUSE Phosphodieste,55783,51890,39631,38152,22589,47732
tr|Q6B822|Q6B822_MOUSE Histone H4 (Fragment) OS=Mus musculus OX=10090 PE=3 SV=1;tr|B2RTM0|B2RTM0_MOUSE Histone H4 OS=Mus musculus OX=10090 GN=Hist2h4 PE=1 SV=1;sp|P62806|H4_MOUSE Histone H4 OS=Mus musculus OX=10090 GN=Hist1h4a PE=1 SV=2;tr|Q61667|Q61667_MO,3119100,718320,470640,679690,279200,541150
"tr|F8WHL1|F8WHL1_MOUSE Zinc transporter 9 OS=Mus musculus OX=10090 GN=Slc30a9 PE=1 SV=1;tr|B2RU82|B2RU82_MOUSE Solute carrier family 30 (Zinc transporter), member 9 OS=Mus musculus OX=10090 GN=Slc30a9 PE=2 SV=1;sp|Q5IRJ6|ZNT9_MOUSE Zinc transporter 9 OS=Mu",1451100,1718500,1515800,1089500,977300,1475100
tr|B2RUD2|B2RUD2_MOUSE Ubp1 protein OS=Mus musculus OX=10090 GN=Ubp1 PE=2 SV=1;sp|Q9ERA0|TFCP2_MOUSE Alpha-globin transcription factor CP2 OS=Mus musculus OX=10090 GN=Tfcp2 PE=1 SV=1;sp|Q811S7|UBIP1_MOUSE Upstream-binding protein 1 OS=Mus musculus OX=10090,87333,95519,87444,53173,69188,87110
tr|Q3TWM9|Q3TWM9_MOUSE Uncharacterized protein (Fragment) OS=Mus musculus OX=10090 GN=Psap PE=2 SV=1;tr|Q3UAS4|Q3UAS4_MOUSE Uncharacterized protein OS=Mus musculus OX=10090 GN=Psap PE=2 SV=1;tr|Q3UE29|Q3UE29_MOUSE Uncharacterized protein OS=Mus musculus OX,152520,258700,205620,133430,64673,190830
tr|E9QLQ9|E9QLQ9_MOUSE Adenomatous polyposis coli protein OS=Mus musculus OX=10090 GN=Apc PE=1 SV=1;tr|B2RUG9|B2RUG9_MOUSE Adenomatosis polyposis coli OS=Mus musculus OX=10090 GN=Apc PE=1 SV=1;sp|Q61315|APC_MOUSE Adenomatous polyposis coli protein OS=Mus m,22494,25922,12155,20870,35651,13781
tr|B7ZNV9|B7ZNV9_MOUSE 6330439K17Rik protein OS=Mus musculus OX=10090 GN=Dzank1 PE=2 SV=1;tr|E9Q4Z6|E9Q4Z6_MOUSE Double zinc ribbon and ankyrin repeat-containing protein 1 OS=Mus musculus OX=10090 GN=Dzank1 PE=1 SV=1;tr|B2RUH8|B2RUH8_MOUSE 6330439K17Rik pr,57591,66433,51739,42900,36011,72318
tr|B2RUJ2|B2RUJ2_MOUSE Erbb2ip protein OS=Mus musculus OX=10090 GN=Erbin PE=1 SV=1;tr|B7ZNY4|B7ZNY4_MOUSE Erbb2 interacting protein OS=Mus musculus OX=10090 GN=Erbin PE=2 SV=1;tr|B7ZNX6|B7ZNX6_MOUSE Erbb2ip protein OS=Mus musculus OX=10090 GN=Erbin PE=1 SV,4435100,4597600,3720300,5143700,2678400,4873900
"tr|B2RUK5|B2RUK5_MOUSE Methylcrotonoyl-Coenzyme A carboxylase 2 (Beta) OS=Mus musculus OX=10090 GN=Mccc2 PE=1 SV=1;sp|Q3ULD5|MCCB_MOUSE Methylcrotonoyl-CoA carboxylase beta chain, mitochondrial OS=Mus musculus OX=10090 GN=Mccc2 PE=1 SV=1;tr|Q6PD20|Q6PD20_M",3268100,3630900,3473400,2200700,2092200,3082000
"tr|B2RUR3|B2RUR3_MOUSE ATP-binding cassette, sub-family B (MDR/TAP), member 1B OS=Mus musculus OX=10090 GN=Abcb1b PE=1 SV=1;sp|P21447|MDR1A_MOUSE Multidrug resistance protein 1A OS=Mus musculus OX=10090 GN=Abcb1a PE=1 SV=3;sp|P06795|MDR1B_MOUSE Multidrug r",207470,207360,176190,180190,120170,233110
"tr|B2RVN8|B2RVN8_MOUSE Family with sequence similarity 163, member B OS=Mus musculus OX=10090 GN=Fam163b PE=1 SV=1;sp|Q8BUM6|F163B_MOUSE Protein FAM163B OS=Mus musculus OX=10090 GN=Fam163b PE=1 SV=1",237510,210280,228140,162510,106640,334960
tr|B2RWC4|B2RWC4_MOUSE Gm88 protein OS=Mus musculus OX=10090 GN=Lrrc73 PE=1 SV=1,0,0,0,0,0,0
"tr|Q80UJ8|Q80UJ8_MOUSE Lactb protein OS=Mus musculus OX=10090 GN=Lactb PE=2 SV=1;tr|B2RWI2|B2RWI2_MOUSE Lactamase, beta OS=Mus musculus OX=10090 GN=Lactb PE=1 SV=1;sp|Q9EP89|LACTB_MOUSE Serine beta-lactamase-like protein LACTB, mitochondrial OS=Mus musculu",153180,111850,136990,61340,88298,130100
tr|Q8BK95|Q8BK95_MOUSE Uncharacterized protein (Fragment) OS=Mus musculus OX=10090 GN=Myo6 PE=2 SV=1;tr|E9Q175|E9Q175_MOUSE Unconventional myosin-VI OS=Mus musculus OX=10090 GN=Myo6 PE=1 SV=1;tr|E9Q3L1|E9Q3L1_MOUSE Unconventional myosin-VI OS=Mus musculus ,8469,3175,5048.2,5000.7,0,12209
tr|B2RWT9|B2RWT9_MOUSE Plexin B1 OS=Mus musculus OX=10090 GN=Plxnb1 PE=2 SV=1;sp|Q8CJH3|PLXB1_MOUSE Plexin-B1 OS=Mus musculus OX=10090 GN=Plxnb1 PE=1 SV=2,2123200,2320500,2223900,1806300,1260400,2479800
"tr|I7HPV9|I7HPV9_MOUSE Phosphatidylinositol 3,4,5-trisphosphate-dependent Rac exchanger 1 protein OS=Mus musculus OX=10090 GN=Prex1 PE=1 SV=1;tr|B9EKR4|B9EKR4_MOUSE Phosphatidylinositol-3,4, 5-trisphosphate-dependent Rac exchange factor 1 OS=Mus musculus O",158880,64539,74746,109300,92090,87634
tr|B2RXT3|B2RXT3_MOUSE Ogdhl protein OS=Mus musculus OX=10090 GN=Ogdhl PE=1 SV=1;tr|E9Q7L0|E9Q7L0_MOUSE Oxoglutarate dehydrogenase-like OS=Mus musculus OX=10090 GN=Ogdhl PE=1 SV=1,37484000,39020000,35995000,30430000,25789000,39759000
tr|B2RXY7|B2RXY7_MOUSE Carbonyl reductase 1 OS=Mus musculus OX=10090 GN=Cbr1 PE=1 SV=1;sp|P48758|CBR1_MOUSE Carbonyl reductase [NADPH] 1 OS=Mus musculus OX=10090 GN=Cbr1 PE=1 SV=3,9866900,10687000,10261000,8303900,7419300,10154000
tr|Q3UTR9|Q3UTR9_MOUSE Uncharacterized protein (Fragment) OS=Mus musculus OX=10090 GN=Trip11 PE=2 SV=1;tr|H3BJG4|H3BJG4_MOUSE Thyroid hormone receptor interactor 11 (Fragment) OS=Mus musculus OX=10090 GN=Trip11 PE=1 SV=1;tr|E9Q512|E9Q512_MOUSE Thyroid horm,12312,6654,16290,15535,3852.6,16376
"tr|B2RY58|B2RY58_MOUSE Hyperpolarization-activated, cyclic nucleotide-gated K+ 4 OS=Mus musculus OX=10090 GN=Hcn4 PE=1 SV=1",1413700,1160200,1252900,1197800,808150,1487000
"tr|B6YY24|B6YY24_MOUSE DNA segment, Chr 15, ERATO Doi 621, expressed, isoform CRA_a OS=Mus musculus OX=10090 GN=Fam91a1 PE=1 SV=1;sp|Q3UVG3|F91A1_MOUSE Protein FAM91A1 OS=Mus musculus OX=10090 GN=Fam91a1 PE=1 SV=1",48435,44282,40734,37307,29493,47452
tr|Q811B2|Q811B2_MOUSE Epb4.1l2 protein OS=Mus musculus OX=10090 GN=Epb41l2 PE=2 SV=1;tr|B6ZHC6|B6ZHC6_MOUSE Erythrocyte protein band 4.1-like 2 OS=Mus musculus OX=10090 GN=Epb41l2 PE=2 SV=1;tr|B6ZHC7|B6ZHC7_MOUSE Erythrocyte protein band 4.1-like 2 OS=Mus,9007900,8631700,8564200,7839800,6384100,9510300
tr|B7ZC90|B7ZC90_MOUSE Rootletin (Fragment) OS=Mus musculus OX=10090 GN=Crocc PE=1 SV=8,0,0,0,0,0,0
tr|B7ZCB8|B7ZCB8_MOUSE Syntaxin-16 (Fragment) OS=Mus musculus OX=10090 GN=Stx16 PE=1 SV=1;tr|F7CJY7|F7CJY7_MOUSE Syntaxin-16 (Fragment) OS=Mus musculus OX=10090 GN=Stx16 PE=1 SV=1;tr|Q8C0W8|Q8C0W8_MOUSE Stx16 protein OS=Mus musculus OX=10090 GN=Stx16 PE=2 ,218610,235880,252010,132500,146460,271830
tr|V9GXM6|V9GXM6_MOUSE Copine-1 (Fragment) OS=Mus musculus OX=10090 GN=Cpne1 PE=1 SV=1;tr|F6R587|F6R587_MOUSE Copine-1 (Fragment) OS=Mus musculus OX=10090 GN=Cpne1 PE=1 SV=1;tr|Q571A1|Q571A1_MOUSE MKIAA0765 splice variant 1 (Fragment) OS=Mus musculus OX=10,258770,254120,320610,195150,164700,248430
tr|Q3UV78|Q3UV78_MOUSE Uncharacterized protein OS=Mus musculus OX=10090 GN=Tcea2 PE=2 SV=1;tr|B7ZCS4|B7ZCS4_MOUSE Transcription elongation factor A protein 2 (Fragment) OS=Mus musculus OX=10090 GN=Tcea2 PE=4 SV=1;tr|F6XMY4|F6XMY4_MOUSE Transcription elonga,134720,139000,148860,84226,86613,140680
"tr|Q9CTC4|Q9CTC4_MOUSE Uncharacterized protein (Fragment) OS=Mus musculus OX=10090 GN=Rgs19 PE=2 SV=1;tr|F8WH97|F8WH97_MOUSE Regulator of G-protein-signaling 17 (Fragment) OS=Mus musculus OX=10090 GN=Rgs17 PE=1 SV=1;tr|Q8CGT5|Q8CGT5_MOUSE GAIP/RGS19, short",9728900,8874100,9963700,5647100,4933900,9243900
tr|B7ZCU2|B7ZCU2_MOUSE Abl interactor 1 OS=Mus musculus OX=10090 GN=Abi1 PE=1 SV=1;tr|B7ZCU5|B7ZCU5_MOUSE Abl interactor 1 OS=Mus musculus OX=10090 GN=Abi1 PE=1 SV=1;tr|Q3UAH6|Q3UAH6_MOUSE Uncharacterized protein OS=Mus musculus OX=10090 GN=Abi1 PE=2 SV=1;,1401400,1890400,1135400,963600,737320,1268700
sp|B7ZMP1|XPP3_MOUSE Xaa-Pro aminopeptidase 3 OS=Mus musculus OX=10090 GN=Xpnpep3 PE=1 SV=1,117740,129010,108970,82409,87898,114370
tr|B7ZMV2|B7ZMV2_MOUSE Uncharacterized protein OS=Mus musculus OX=10090 GN=2810459M11Rik PE=2 SV=1;sp|Q9CYS6|CB072_MOUSE Uncharacterized protein C2orf72 homolog OS=Mus musculus OX=10090 PE=1 SV=2,468590,83016,340170,293850,174170,417870
"tr|Q8BVR8|Q8BVR8_MOUSE Centaurin, alpha 1, isoform CRA_b OS=Mus musculus OX=10090 GN=Adap1 PE=2 SV=1;tr|Q6PGM4|Q6PGM4_MOUSE Adap1 protein (Fragment) OS=Mus musculus OX=10090 GN=Adap1 PE=2 SV=1;tr|B7ZMY4|B7ZMY4_MOUSE Adap1 protein (Fragment) OS=Mus musculus",1266600,1075900,1210600,1058500,782070,1542800
tr|B7ZN02|B7ZN02_MOUSE MCG55337 OS=Mus musculus OX=10090 GN=Jcad PE=1 SV=1;sp|Q5DTX6|JCAD_MOUSE Junctional protein associated with coronary artery disease OS=Mus musculus OX=10090 GN=Jcad PE=1 SV=2,235130,237780,191230,216780,185250,260030
tr|B7ZN40|B7ZN40_MOUSE ADP-ribosylation factor-like protein 15 OS=Mus musculus OX=10090 GN=Arl15 PE=1 SV=1;sp|Q8BGR6|ARL15_MOUSE ADP-ribosylation factor-like protein 15 OS=Mus musculus OX=10090 GN=Arl15 PE=1 SV=1,771880,1023600,829060,707940,405350,1005600
tr|B7ZNF6|B7ZNF6_MOUSE Catenin delta-2 OS=Mus musculus OX=10090 GN=Ctnnd2 PE=1 SV=1;tr|E9QKH8|E9QKH8_MOUSE Catenin delta-2 OS=Mus musculus OX=10090 GN=Ctnnd2 PE=1 SV=1;sp|O35927|CTND2_MOUSE Catenin delta-2 OS=Mus musculus OX=10090 GN=Ctnnd2 PE=1 SV=1,2484100,2727100,1875800,2254600,1655400,2163000
tr|B7ZNJ3|B7ZNJ3_MOUSE Caskin1 protein OS=Mus musculus OX=10090 GN=Caskin1 PE=2 SV=1;sp|Q6P9K8|CSKI1_MOUSE Caskin-1 OS=Mus musculus OX=10090 GN=Caskin1 PE=1 SV=2,2679400,3397800,2388900,2139200,1570100,2967800
tr|B7ZP20|B7ZP20_MOUSE Ankyrin repeat and FYVE domain containing 1 OS=Mus musculus OX=10090 GN=Ankfy1 PE=2 SV=1;sp|Q810B6|ANFY1_MOUSE Rabankyrin-5 OS=Mus musculus OX=10090 GN=Ankfy1 PE=1 SV=2,79828,72216,69962,52044,43298,87638
tr|B7ZP22|B7ZP22_MOUSE Heterogeneous nuclear ribonucleoprotein A2/B1 OS=Mus musculus OX=10090 GN=Hnrnpa2b1 PE=2 SV=1;sp|O88569|ROA2_MOUSE Heterogeneous nuclear ribonucleoproteins A2/B1 OS=Mus musculus OX=10090 GN=Hnrnpa2b1 PE=1 SV=2,18130000,20469000,15969000,13894000,11099000,16693000
