Fasta headers,Reporter intensity corrected 0,Reporter intensity corrected 1,Reporter intensity corrected 2,Reporter intensity corrected 3,Reporter intensity corrected 4,Reporter intensity corrected 5
tr|Q5M8Q0|Q5M8Q0_MOUSE Ribosomal protein L15 OS=Mus musculus OX=10090 GN=Rpl15 PE=2 SV=1;tr|Q3U7D2|Q3U7D2_MOUSE Ribosomal protein L15 OS=Mus musculus OX=10090 GN=Rpl15 PE=2 SV=1;sp|Q9CZM2|RL15_MOUSE 60S ribosomal protein L15 OS=Mus musculus OX=10090 GN=Rpl,11039000,11318000,9559400,8159900,4807800,12174000
tr|Q5HZY7|Q5HZY7_MOUSE V-type proton ATPase subunit G OS=Mus musculus OX=10090 GN=Atp6v1g1 PE=1 SV=1;tr|Q3U7E0|Q3U7E0_MOUSE V-type proton ATPase subunit G OS=Mus musculus OX=10090 GN=Atp6v1g1 PE=2 SV=1;sp|Q9CR51|VATG1_MOUSE V-type proton ATPase subunit G 1,513960,503710,459050,340330,221500,471760
tr|Q3U7Z6|Q3U7Z6_MOUSE Phosphoglycerate mutase OS=Mus musculus OX=10090 GN=Pgam1 PE=1 SV=1;sp|Q9DBJ1|PGAM1_MOUSE Phosphoglycerate mutase 1 OS=Mus musculus OX=10090 GN=Pgam1 PE=1 SV=3;tr|Q6NWV5|Q6NWV5_MOUSE Pgam1 protein (Fragment) OS=Mus musculus OX=10090 ,18108000,18559000,8161300,20664000,23566000,10091000
"tr|Q3U878|Q3U878_MOUSE Uncharacterized protein OS=Mus musculus OX=10090 GN=Dazap1 PE=2 SV=1;tr|Q3UGB5|Q3UGB5_MOUSE DAZ associated protein 1, isoform CRA_b OS=Mus musculus OX=10090 GN=Dazap1 PE=1 SV=1;sp|Q9JII5|DAZP1_MOUSE DAZ-associated protein 1 OS=Mus mu",770710,834470,724980,638630,462920,854890
tr|Q9D094|Q9D094_MOUSE Uncharacterized protein OS=Mus musculus OX=10090 GN=Hars PE=2 SV=1;tr|Q8VDX8|Q8VDX8_MOUSE Hars protein OS=Mus musculus OX=10090 GN=Hars PE=2 SV=1;tr|Q3UDH1|Q3UDH1_MOUSE Uncharacterized protein OS=Mus musculus OX=10090 GN=Hars PE=2 SV,4742900,5786000,5891400,3699600,2597100,5738000
tr|Q3U896|Q3U896_MOUSE Uncharacterized protein OS=Mus musculus OX=10090 GN=Mtmr9 PE=2 SV=1;sp|Q9Z2D0|MTMR9_MOUSE Myotubularin-related protein 9 OS=Mus musculus OX=10090 GN=Mtmr9 PE=1 SV=2,1814400,2032600,1809100,1431800,1215500,1892500
tr|Q3U8R9|Q3U8R9_MOUSE Uncharacterized protein OS=Mus musculus OX=10090 GN=Txnl1 PE=2 SV=1;tr|Q3UNH3|Q3UNH3_MOUSE Uncharacterized protein (Fragment) OS=Mus musculus OX=10090 GN=Txnl1 PE=2 SV=1;sp|Q8CDN6|TXNL1_MOUSE Thioredoxin-like protein 1 OS=Mus musculu,2452100,2166200,2606700,1652500,1368800,2949800
"tr|Q3U8S0|Q3U8S0_MOUSE Adaptor-related protein complex 3, sigma 1 subunit OS=Mus musculus OX=10090 GN=Ap3s1 PE=1 SV=1;sp|Q9DCR2|AP3S1_MOUSE AP-3 complex subunit sigma-1 OS=Mus musculus OX=10090 GN=Ap3s1 PE=1 SV=2",628700,860720,585300,502640,382140,631130
tr|Q6IRT4|Q6IRT4_MOUSE Eukaryotic translation initiation factor 3 subunit F OS=Mus musculus OX=10090 GN=Eif3f PE=2 SV=1;tr|Q8BTW2|Q8BTW2_MOUSE Eukaryotic translation initiation factor 3 subunit F OS=Mus musculus OX=10090 GN=Eif3f PE=2 SV=1;tr|Q3U8X1|Q3U8X1,1790000,1462000,1579600,1627000,1082400,1841600
tr|Q3U944|Q3U944_MOUSE Uncharacterized protein OS=Mus musculus OX=10090 GN=Lman1 PE=2 SV=1;sp|Q9D0F3|LMAN1_MOUSE Protein ERGIC-53 OS=Mus musculus OX=10090 GN=Lman1 PE=1 SV=1,1134700,1183900,1262300,805020,631850,1311100
"tr|Q3U9C4|Q3U9C4_MOUSE Uncharacterized protein (Fragment) OS=Mus musculus OX=10090 GN=Mrpl44 PE=2 SV=1;tr|Q3UKG1|Q3UKG1_MOUSE Uncharacterized protein (Fragment) OS=Mus musculus OX=10090 GN=Mrpl44 PE=2 SV=1;sp|Q9CY73|RM44_MOUSE 39S ribosomal protein L44, mi",139430,199670,146580,128790,94094,178980
tr|Q3U9D6|Q3U9D6_MOUSE Exocyst complex component OS=Mus musculus OX=10090 GN=Exoc6 PE=1 SV=1;sp|Q8R313|EXOC6_MOUSE Exocyst complex component 6 OS=Mus musculus OX=10090 GN=Exoc6 PE=1 SV=2,54263,44623,47861,40929,34995,49978
tr|Q3U9U5|Q3U9U5_MOUSE Uncharacterized protein OS=Mus musculus OX=10090 GN=Bcap31 PE=2 SV=1;sp|Q61335|BAP31_MOUSE B-cell receptor-associated protein 31 OS=Mus musculus OX=10090 GN=Bcap31 PE=1 SV=4,171300,147390,87400,200370,203660,84699
tr|Q3UA52|Q3UA52_MOUSE Arp2/3 complex 34 kDa subunit (Fragment) OS=Mus musculus OX=10090 GN=Arpc2 PE=2 SV=1;sp|Q9CVB6|ARPC2_MOUSE Actin-related protein 2/3 complex subunit 2 OS=Mus musculus OX=10090 GN=Arpc2 PE=1 SV=3;tr|Q4FZG5|Q4FZG5_MOUSE Arp2/3 complex ,13183000,10650000,10172000,10498000,8431100,11448000
tr|Q4FK49|Q4FK49_MOUSE Pyp protein OS=Mus musculus OX=10090 GN=Ppa1 PE=1 SV=1;tr|Q3UA53|Q3UA53_MOUSE Uncharacterized protein OS=Mus musculus OX=10090 GN=Ppa1 PE=2 SV=1;sp|Q9D819|IPYR_MOUSE Inorganic pyrophosphatase OS=Mus musculus OX=10090 GN=Ppa1 PE=1 SV=,2673800,2553700,2369400,2213000,1494800,2568700
"tr|Q91V28|Q91V28_MOUSE 6-phosphogluconate dehydrogenase, decarboxylating OS=Mus musculus OX=10090 GN=Pgd PE=2 SV=1;tr|Q3UAG2|Q3UAG2_MOUSE 6-phosphogluconate dehydrogenase, decarboxylating OS=Mus musculus OX=10090 GN=Pgd PE=2 SV=1;sp|Q9DCD0|6PGD_MOUSE 6-pho",2148500,2264400,2372700,1763500,1276900,2268900
tr|Q3UB60|Q3UB60_MOUSE Uncharacterized protein OS=Mus musculus OX=10090 GN=Ppid PE=2 SV=1;sp|Q9CR16|PPID_MOUSE Peptidyl-prolyl cis-trans isomerase D OS=Mus musculus OX=10090 GN=Ppid PE=1 SV=3,1588300,1698100,1540200,1273500,1311200,1394400
"tr|Q3UBT6|Q3UBT6_MOUSE Casein kinase 1, delta, isoform CRA_c OS=Mus musculus OX=10090 GN=Csnk1d PE=2 SV=1;tr|Q3USK2|Q3USK2_MOUSE Casein kinase 1, delta, isoform CRA_b OS=Mus musculus OX=10090 GN=Csnk1d PE=2 SV=1;sp|Q9DC28|KC1D_MOUSE Casein kinase I isoform",463860,571560,489780,312180,177230,565450
tr|Q3UBW3|Q3UBW3_MOUSE Uncharacterized protein OS=Mus musculus OX=10090 GN=Tomm22 PE=2 SV=1;sp|Q9CPQ3|TOM22_MOUSE Mitochondrial import receptor subunit TOM22 homolog OS=Mus musculus OX=10090 GN=Tomm22 PE=1 SV=3,37963,35503,36332,34339,34245,50252
tr|Q3UUX9|Q3UUX9_MOUSE Rab GDP dissociation inhibitor OS=Mus musculus OX=10090 GN=Gdi2 PE=2 SV=1;tr|Q3UC72|Q3UC72_MOUSE Rab GDP dissociation inhibitor (Fragment) OS=Mus musculus OX=10090 GN=Gdi2 PE=2 SV=1;tr|Q3UPA3|Q3UPA3_MOUSE Rab GDP dissociation inhibit,7019700,4603000,6027100,5443300,5331200,6457600
"tr|Q3UCC6|Q3UCC6_MOUSE Succinate-CoA ligase subunit beta (Fragment) OS=Mus musculus OX=10090 GN=Sucla2 PE=2 SV=1;sp|Q9Z2I9|SUCB1_MOUSE Succinate--CoA ligase [ADP-forming] subunit beta, mitochondrial OS=Mus musculus OX=10090 GN=Sucla2 PE=1 SV=2;tr|Q3U6C7|Q3",35478000,38148000,29711000,31618000,31049000,28438000
tr|Q8C2Q8|Q8C2Q8_MOUSE ATP synthase subunit gamma OS=Mus musculus OX=10090 GN=Atp5c1 PE=1 SV=1;tr|Q9D9D7|Q9D9D7_MOUSE ATP synthase subunit gamma OS=Mus musculus OX=10090 GN=Atp5c1 PE=2 SV=1;tr|Q3UD06|Q3UD06_MOUSE ATP synthase subunit gamma OS=Mus musculus ,22344000,23419000,20655000,17752000,19074000,20050000
"tr|Q6XMP4|Q6XMP4_MOUSE Alanyl-tRNA synthase OS=Mus musculus OX=10090 GN=Aars PE=2 SV=1;tr|Q3UD67|Q3UD67_MOUSE Uncharacterized protein OS=Mus musculus OX=10090 GN=Aars PE=2 SV=1;sp|Q8BGQ7|SYAC_MOUSE Alanine--tRNA ligase, cytoplasmic OS=Mus musculus OX=10090",5880000,6378000,6270400,4631400,3304800,6977900
sp|Q3UDE2|TTL12_MOUSE Tubulin--tyrosine ligase-like protein 12 OS=Mus musculus OX=10090 GN=Ttll12 PE=1 SV=1,635310,666320,529380,475490,347360,578240
sp|Q3UE37|UBE2Z_MOUSE Ubiquitin-conjugating enzyme E2 Z OS=Mus musculus OX=10090 GN=Ube2z PE=1 SV=2,1400900,1233800,1400800,1126900,874780,1442400
"tr|Q3UKF5|Q3UKF5_MOUSE X-prolyl aminopeptidase OS=Mus musculus OX=10090 GN=Xpnpep1 PE=2 SV=1;tr|Q3UE92|Q3UE92_MOUSE X-prolyl aminopeptidase (Aminopeptidase P) 1, soluble, isoform CRA_b OS=Mus musculus OX=10090 GN=Xpnpep1 PE=1 SV=1;sp|Q6P1B1|XPP1_MOUSE Xaa-",2538900,2739100,2483400,2191700,1692100,2959700
sp|Q3UEB3|PUF60_MOUSE Poly(U)-binding-splicing factor PUF60 OS=Mus musculus OX=10090 GN=Puf60 PE=1 SV=2;tr|Q0VDY2|Q0VDY2_MOUSE Puf60 protein (Fragment) OS=Mus musculus OX=10090 GN=Puf60 PE=2 SV=1,133310,146180,122120,96888,70845,127620
"tr|Q9DC36|Q9DC36_MOUSE Uncharacterized protein OS=Mus musculus OX=10090 GN=Flot2 PE=2 SV=1;tr|Q8CDE0|Q8CDE0_MOUSE Uncharacterized protein OS=Mus musculus OX=10090 GN=Flot2 PE=2 SV=1;tr|Q5SS83|Q5SS83_MOUSE Flotillin 2, isoform CRA_a OS=Mus musculus OX=10090",1817600,1521400,1617800,1453200,1005100,1761400
"tr|Q3UWN2|Q3UWN2_MOUSE Uncharacterized protein OS=Mus musculus OX=10090 GN=Aass PE=2 SV=1;tr|Q3UEQ9|Q3UEQ9_MOUSE Aminoadipate-semialdehyde synthase OS=Mus musculus OX=10090 GN=Aass PE=1 SV=1;sp|Q99K67|AASS_MOUSE Alpha-aminoadipic semialdehyde synthase, mit",40520,51595,47931,48867,21228,58528
tr|Q3UEW2|Q3UEW2_MOUSE Uncharacterized protein OS=Mus musculus OX=10090 GN=Dmtn PE=2 SV=1;sp|Q9WV69|DEMA_MOUSE Dematin OS=Mus musculus OX=10090 GN=Dmtn PE=1 SV=1,1088200,1499300,1054500,935780,735360,1398700
"tr|Q3V060|Q3V060_MOUSE Kv channel interacting protein 4, isoform CRA_a OS=Mus musculus OX=10090 GN=Kcnip4 PE=2 SV=1;tr|Q3YAA7|Q3YAA7_MOUSE Potassium channel interacting protein 4 OS=Mus musculus OX=10090 GN=Kcnip4 PE=2 SV=1;tr|Q3UFC0|Q3UFC0_MOUSE Kv channe",1203400,1170600,1194200,812140,744270,1091700
"tr|Q3UKA1|Q3UKA1_MOUSE Uncharacterized protein OS=Mus musculus OX=10090 GN=Dnajc3 PE=2 SV=1;tr|Q3UFV9|Q3UFV9_MOUSE DnaJ (Hsp40) homolog, subfamily C, member 3 OS=Mus musculus OX=10090 GN=Dnajc3 PE=1 SV=1;sp|Q91YW3|DNJC3_MOUSE DnaJ homolog subfamily C membe",275250,334910,234390,235460,162320,247810
tr|Q3V331|Q3V331_MOUSE Uncharacterized protein OS=Mus musculus OX=10090 GN=Gnb5 PE=2 SV=1;tr|Q3UG14|Q3UG14_MOUSE Uncharacterized protein OS=Mus musculus OX=10090 GN=Gnb5 PE=2 SV=1;sp|P62881|GNB5_MOUSE Guanine nucleotide-binding protein subunit beta-5 OS=Mu,9390500,8741000,8784700,8557500,7594000,11082000
tr|Q8CFS5|Q8CFS5_MOUSE Vps18 protein OS=Mus musculus OX=10090 GN=Vps18 PE=2 SV=1;tr|Q8BLK7|Q8BLK7_MOUSE Uncharacterized protein OS=Mus musculus OX=10090 GN=Vps18 PE=2 SV=1;tr|Q3UG80|Q3UG80_MOUSE Uncharacterized protein OS=Mus musculus OX=10090 GN=Vps18 PE=,0,0,0,0,0,0
tr|Q3UGB8|Q3UGB8_MOUSE Derlin OS=Mus musculus OX=10090 GN=Derl1 PE=2 SV=1;sp|Q99J56|DERL1_MOUSE Derlin-1 OS=Mus musculus OX=10090 GN=Derl1 PE=1 SV=1,0,4411,0,0,0,0
tr|Q3UGC1|Q3UGC1_MOUSE Uncharacterized protein OS=Mus musculus OX=10090 GN=Strip1 PE=2 SV=1;sp|Q8C079|STRP1_MOUSE Striatin-interacting protein 1 OS=Mus musculus OX=10090 GN=Strip1 PE=1 SV=2,390520,447470,392090,400540,236040,468470
"tr|Q3UGC8|Q3UGC8_MOUSE Propionyl-Coenzyme A carboxylase, alpha polypeptide, isoform CRA_b OS=Mus musculus OX=10090 GN=Pcca PE=1 SV=1;sp|Q91ZA3|PCCA_MOUSE Propionyl-CoA carboxylase alpha chain, mitochondrial OS=Mus musculus OX=10090 GN=Pcca PE=1 SV=2",6361800,7235400,6302300,4683100,3954200,5828100
tr|Q3UGE1|Q3UGE1_MOUSE Uncharacterized protein OS=Mus musculus OX=10090 GN=Trappc12 PE=2 SV=1;sp|Q8K2L8|TPC12_MOUSE Trafficking protein particle complex subunit 12 OS=Mus musculus OX=10090 GN=Trappc12 PE=1 SV=2,55542,58603,57003,40781,27339,57454
sp|Q3UGR5|HDHD2_MOUSE Haloacid dehalogenase-like hydrolase domain-containing protein 2 OS=Mus musculus OX=10090 GN=Hdhd2 PE=1 SV=2,2216100,3551000,2689100,1426900,1205600,2464300
sp|Q3UGS4|MCRI1_MOUSE Mapk-regulated corepressor-interacting protein 1 OS=Mus musculus OX=10090 GN=Mcrip1 PE=1 SV=1,717820,732080,783100,527470,299090,771270
tr|Q3UGY7|Q3UGY7_MOUSE F-box protein 41 OS=Mus musculus OX=10090 GN=Fbxo41 PE=1 SV=1;sp|Q6NS60|FBX41_MOUSE F-box only protein 41 OS=Mus musculus OX=10090 GN=Fbxo41 PE=1 SV=3,1233800,1296800,1445900,688070,467550,1325700
tr|Q3UGZ2|Q3UGZ2_MOUSE Uncharacterized protein OS=Mus musculus OX=10090 GN=Cntn2 PE=2 SV=1;tr|Q3UH39|Q3UH39_MOUSE Uncharacterized protein OS=Mus musculus OX=10090 GN=Cntn2 PE=2 SV=1;sp|Q61330|CNTN2_MOUSE Contactin-2 OS=Mus musculus OX=10090 GN=Cntn2 PE=1 S,3416200,3273300,3503500,2159500,1374700,3480000
tr|Q5SV64|Q5SV64_MOUSE Myosin-10 OS=Mus musculus OX=10090 GN=Myh10 PE=1 SV=1;tr|Q3UH59|Q3UH59_MOUSE Myosin-10 OS=Mus musculus OX=10090 GN=Myh10 PE=1 SV=1;sp|Q61879|MYH10_MOUSE Myosin-10 OS=Mus musculus OX=10090 GN=Myh10 PE=1 SV=2;tr|Q80T68|Q80T68_MOUSE MKI,50182000,30802000,48516000,32460000,17758000,37522000
sp|Q3UH60|DIP2B_MOUSE Disco-interacting protein 2 homolog B OS=Mus musculus OX=10090 GN=Dip2b PE=1 SV=1;tr|B2RQC7|B2RQC7_MOUSE DIP2 disco-interacting protein 2 homolog B (Drosophila) OS=Mus musculus OX=10090 GN=Dip2b PE=1 SV=1;tr|D3Z5G8|D3Z5G8_MOUSE Disco-,1105100,1443400,1391200,971450,545430,1664800
tr|Q6ZQ83|Q6ZQ83_MOUSE MKIAA0620 protein (Fragment) OS=Mus musculus OX=10090 GN=Plxnd1 PE=2 SV=1;sp|Q3UH93|PLXD1_MOUSE Plexin-D1 OS=Mus musculus OX=10090 GN=Plxnd1 PE=1 SV=1,202290,176800,152450,135300,124270,205180
sp|Q3UHB8|CC177_MOUSE Coiled-coil domain-containing protein 177 OS=Mus musculus OX=10090 GN=Ccdc177 PE=1 SV=1,613260,848180,631480,599450,368470,734960
sp|Q3UHD6|SNX27_MOUSE Sorting nexin-27 OS=Mus musculus OX=10090 GN=Snx27 PE=1 SV=2,3840200,4455600,4381100,2773400,1901100,3885800
"sp|Q3UHD9|AGAP2_MOUSE Arf-GAP with GTPase, ANK repeat and PH domain-containing protein 2 OS=Mus musculus OX=10090 GN=Agap2 PE=1 SV=1",2882600,3033900,1902600,2248500,1730200,2341200
tr|Q8R0Q6|Q8R0Q6_MOUSE Tspan7 protein OS=Mus musculus OX=10090 GN=Tspan7 PE=2 SV=1;tr|Q3UHG5|Q3UHG5_MOUSE Tetraspanin OS=Mus musculus OX=10090 GN=Tspan7 PE=1 SV=1;tr|Q6PDN6|Q6PDN6_MOUSE Tetraspanin OS=Mus musculus OX=10090 GN=Tspan7 PE=2 SV=1;sp|Q62283|TSN,811790,1075600,1029000,487100,524720,907300
sp|Q3UHJ0|AAK1_MOUSE AP2-associated protein kinase 1 OS=Mus musculus OX=10090 GN=Aak1 PE=1 SV=2,5885100,5208600,5701400,4802300,3480500,6769100
tr|Q3UHM2|Q3UHM2_MOUSE Uncharacterized protein OS=Mus musculus OX=10090 GN=Traf3 PE=2 SV=1;tr|Q3UHJ1|Q3UHJ1_MOUSE TNF receptor-associated factor 3 OS=Mus musculus OX=10090 GN=Traf3 PE=1 SV=1;sp|Q60803|TRAF3_MOUSE TNF receptor-associated factor 3 OS=Mus mus,44207,36904,41638,23687,27580,42594
sp|Q3UHK1|MYCT_MOUSE Proton myo-inositol cotransporter OS=Mus musculus OX=10090 GN=Slc2a13 PE=1 SV=2;tr|Q0VDP2|Q0VDP2_MOUSE Slc2a13 protein OS=Mus musculus OX=10090 GN=Slc2a13 PE=2 SV=2;tr|Q0VDP1|Q0VDP1_MOUSE Slc2a13 protein (Fragment) OS=Mus musculus OX=1,2123700,2185500,2152200,1300400,1286400,1801300
tr|Q3UHK5|Q3UHK5_MOUSE Sodium/potassium-transporting ATPase subunit alpha OS=Mus musculus OX=10090 GN=Atp1a2 PE=1 SV=1;tr|Q6ZQ49|Q6ZQ49_MOUSE Sodium/potassium-transporting ATPase subunit alpha (Fragment) OS=Mus musculus OX=10090 GN=Atp1a2 PE=2 SV=1;sp|Q6PI,164230000,178090000,162080000,141710000,138070000,164370000
sp|Q3UHK6|TEN4_MOUSE Teneurin-4 OS=Mus musculus OX=10090 GN=Tenm4 PE=1 SV=2,73219,59408,70461,45302,40513,74613
sp|Q3UHL1|CAMKV_MOUSE CaM kinase-like vesicle-associated protein OS=Mus musculus OX=10090 GN=Camkv PE=1 SV=2;tr|A0A0A6YW88|A0A0A6YW88_MOUSE CaM kinase-like vesicle-associated protein OS=Mus musculus OX=10090 GN=Camkv PE=1 SV=1,25753000,27559000,21280000,18681000,17056000,24104000
tr|Q5J8K8|Q5J8K8_MOUSE CAST1/ERC2 splicing variant-1 OS=Mus musculus OX=10090 GN=Erc2 PE=2 SV=1;tr|Q3UHT7|Q3UHT7_MOUSE ERC protein 2 OS=Mus musculus OX=10090 GN=Erc2 PE=1 SV=1;tr|Q5J8K6|Q5J8K6_MOUSE CAST1/ERC2 splicing variant-3 OS=Mus musculus OX=10090 GN,7549400,7016400,5713800,5090300,3274400,7270100
sp|Q3UHU5|MTCL1_MOUSE Microtubule cross-linking factor 1 OS=Mus musculus OX=10090 GN=Mtcl1 PE=1 SV=1,5975,10222,4473.4,7226.1,3280.6,3890.2
tr|Q5SUT0|Q5SUT0_MOUSE RNA-binding protein EWS OS=Mus musculus OX=10090 GN=Ewsr1 PE=1 SV=1;tr|Q3UI30|Q3UI30_MOUSE Uncharacterized protein OS=Mus musculus OX=10090 GN=Ewsr1 PE=2 SV=1;tr|Q6NVA3|Q6NVA3_MOUSE Ewing sarcoma breakpoint region 1 OS=Mus musculus O,1113200,713790,862750,588770,415660,1020600
tr|Q3UIH7|Q3UIH7_MOUSE Uncharacterized protein OS=Mus musculus OX=10090 GN=Rabggta PE=2 SV=1;sp|Q9JHK4|PGTA_MOUSE Geranylgeranyl transferase type-2 subunit alpha OS=Mus musculus OX=10090 GN=Rabggta PE=1 SV=1;tr|Q921J9|Q921J9_MOUSE Rabggta protein OS=Mus mu,2140400,2043300,2202000,1716200,1298500,2205100
tr|Q8K0I5|Q8K0I5_MOUSE 3-hydroxy-3-methylglutaryl coenzyme A synthase OS=Mus musculus OX=10090 GN=Hmgcs1 PE=2 SV=1;tr|Q3UWQ9|Q3UWQ9_MOUSE 3-hydroxy-3-methylglutaryl coenzyme A synthase OS=Mus musculus OX=10090 GN=Hmgcs1 PE=2 SV=1;tr|Q3UKE7|Q3UKE7_MOUSE 3-h,71038,67085,76911,49144,25605,70166
"tr|Q3UJ95|Q3UJ95_MOUSE Phosphatidylinositol-4-phosphate 5-kinase, type II, beta OS=Mus musculus OX=10090 GN=Pip4k2b PE=1 SV=1;sp|Q80XI4|PI42B_MOUSE Phosphatidylinositol 5-phosphate 4-kinase type-2 beta OS=Mus musculus OX=10090 GN=Pip4k2b PE=1 SV=1",8694600,8653600,7237800,6764500,5335400,9221600
tr|Q8BSZ8|Q8BSZ8_MOUSE Uncharacterized protein OS=Mus musculus OX=10090 GN=Srm PE=2 SV=1;tr|Q543H0|Q543H0_MOUSE MCG16662 OS=Mus musculus OX=10090 GN=Srm PE=1 SV=1;tr|Q3UJL7|Q3UJL7_MOUSE Uncharacterized protein OS=Mus musculus OX=10090 GN=Srm PE=2 SV=1;sp|Q,2446400,2211800,2543700,1708900,1522200,2221200
sp|Q3UJP5|CH037_MOUSE Protein C8orf37 homolog OS=Mus musculus OX=10090 PE=1 SV=1;tr|B1AV75|B1AV75_MOUSE RIKEN cDNA 2610301B20 gene OS=Mus musculus OX=10090 GN=2610301B20Rik PE=1 SV=1,790130,807950,808070,630350,668760,786220
tr|Q3UJP8|Q3UJP8_MOUSE Trifunctional purine biosynthetic protein adenosine-3 OS=Mus musculus OX=10090 GN=Gart PE=2 SV=1;sp|Q64737|PUR2_MOUSE Trifunctional purine biosynthetic protein adenosine-3 OS=Mus musculus OX=10090 GN=Gart PE=1 SV=3;tr|Q3TH49|Q3TH49_M,238230,142080,177580,129410,121740,168710
sp|Q3UJU9|RMD3_MOUSE Regulator of microtubule dynamics protein 3 OS=Mus musculus OX=10090 GN=Rmdn3 PE=1 SV=2,259600,179720,238580,186840,159410,252230
"tr|Q80XJ7|Q80XJ7_MOUSE Aldo-keto reductase family 1, member A4 (Aldehyde reductase) OS=Mus musculus OX=10090 GN=Akr1a1 PE=2 SV=1;tr|Q540D7|Q540D7_MOUSE Aldehyde reductase OS=Mus musculus OX=10090 GN=Akr1a1 PE=1 SV=1;tr|Q3UJW9|Q3UJW9_MOUSE Uncharacterized p",5538300,6796300,5750400,5397100,3895700,6089600
tr|Q3UKS4|Q3UKS4_MOUSE Uncharacterized protein OS=Mus musculus OX=10090 GN=Ctnnbl1 PE=2 SV=1;tr|Q3UJX2|Q3UJX2_MOUSE Uncharacterized protein OS=Mus musculus OX=10090 GN=Ctnnbl1 PE=2 SV=1;sp|Q9CWL8|CTBL1_MOUSE Beta-catenin-like protein 1 OS=Mus musculus OX=1,296910,371240,277360,273060,182950,346340
tr|Q3UK24|Q3UK24_MOUSE Uncharacterized protein OS=Mus musculus OX=10090 GN=Wdr37 PE=2 SV=1;sp|Q8CBE3|WDR37_MOUSE WD repeat-containing protein 37 OS=Mus musculus OX=10090 GN=Wdr37 PE=1 SV=1,4805800,4771300,4473100,3536800,2688500,4381800
tr|Q3UK85|Q3UK85_MOUSE Uncharacterized protein OS=Mus musculus OX=10090 GN=Dctn5 PE=2 SV=1;sp|Q9QZB9|DCTN5_MOUSE Dynactin subunit 5 OS=Mus musculus OX=10090 GN=Dctn5 PE=1 SV=1;tr|H3BJ75|H3BJ75_MOUSE Dynactin subunit 5 OS=Mus musculus OX=10090 GN=Dctn5 PE=1,1233500,1367000,1268100,964840,708110,1431000
sp|Q3UKC1|TAXB1_MOUSE Tax1-binding protein 1 homolog OS=Mus musculus OX=10090 GN=Tax1bp1 PE=1 SV=2,94889,91308,81874,64266,49668,104070
"tr|Q3UKH3|Q3UKH3_MOUSE Uncharacterized protein OS=Mus musculus OX=10090 GN=Acaa2 PE=2 SV=1;sp|Q8BWT1|THIM_MOUSE 3-ketoacyl-CoA thiolase, mitochondrial OS=Mus musculus OX=10090 GN=Acaa2 PE=1 SV=3",3912600,4369300,4122600,3243700,2817000,3820800
tr|Q3UKP6|Q3UKP6_MOUSE Uncharacterized protein OS=Mus musculus OX=10090 GN=Baiap2 PE=2 SV=1;tr|B1AZ46|B1AZ46_MOUSE Brain-specific angiogenesis inhibitor 1-associated protein 2 OS=Mus musculus OX=10090 GN=Baiap2 PE=1 SV=1;sp|Q8BKX1|BAIP2_MOUSE Brain-specifi,5964800,5650000,3734000,3952200,3019700,4154800
tr|Q3ULL5|Q3ULL5_MOUSE Eif2s2 protein OS=Mus musculus OX=10090 GN=Eif2s2 PE=1 SV=1;sp|Q99L45|IF2B_MOUSE Eukaryotic translation initiation factor 2 subunit 2 OS=Mus musculus OX=10090 GN=Eif2s2 PE=1 SV=1,1310200,955190,1232500,716270,728510,1490500
tr|Q3ULN6|Q3ULN6_MOUSE Uncharacterized protein OS=Mus musculus OX=10090 GN=Sccpdh PE=2 SV=1;sp|Q8R127|SCPDL_MOUSE Saccharopine dehydrogenase-like oxidoreductase OS=Mus musculus OX=10090 GN=Sccpdh PE=1 SV=1;tr|J3QNN5|J3QNN5_MOUSE Saccharopine dehydrogenase-,2875300,3355800,2943000,1713100,1344800,2711200
tr|Q3UM23|Q3UM23_MOUSE Uncharacterized protein OS=Mus musculus OX=10090 GN=Rnh1 PE=2 SV=1;sp|Q91VI7|RINI_MOUSE Ribonuclease inhibitor OS=Mus musculus OX=10090 GN=Rnh1 PE=1 SV=1;tr|A0A1B0GSG5|A0A1B0GSG5_MOUSE Ribonuclease inhibitor OS=Mus musculus OX=10090 ,1797900,1536200,1896300,1262700,1149700,1733000
sp|Q3UM45|PP1R7_MOUSE Protein phosphatase 1 regulatory subunit 7 OS=Mus musculus OX=10090 GN=Ppp1r7 PE=1 SV=2,13444000,13309000,14163000,8072900,8121600,12369000
"tr|Q3UM63|Q3UM63_MOUSE Solute carrier family 30 (Zinc transporter), member 1 OS=Mus musculus OX=10090 GN=Slc30a1 PE=1 SV=1;sp|Q60738|ZNT1_MOUSE Zinc transporter 1 OS=Mus musculus OX=10090 GN=Slc30a1 PE=1 SV=1",684620,474370,685580,211000,392590,689230
tr|Q3UM95|Q3UM95_MOUSE Uncharacterized protein OS=Mus musculus OX=10090 GN=Vipas39 PE=2 SV=1;sp|Q8BGQ1|SPE39_MOUSE Spermatogenesis-defective protein 39 homolog OS=Mus musculus OX=10090 GN=Vipas39 PE=1 SV=1,0,0,0,5113.8,0,0
sp|Q3UMB5|SMCR8_MOUSE Guanine nucleotide exchange protein SMCR8 OS=Mus musculus OX=10090 GN=Smcr8 PE=1 SV=2,161890,199370,140890,144640,83858,174500
tr|Q3UMM1|Q3UMM1_MOUSE Tubulin beta chain OS=Mus musculus OX=10090 GN=Tubb6 PE=1 SV=1;sp|Q922F4|TBB6_MOUSE Tubulin beta-6 chain OS=Mus musculus OX=10090 GN=Tubb6 PE=1 SV=1;tr|Q3U9U3|Q3U9U3_MOUSE Tubulin beta chain OS=Mus musculus OX=10090 GN=Tubb6 PE=2 SV=,6448.9,51573,7288.2,25502,0,11888
tr|Q3UMQ2|Q3UMQ2_MOUSE Uncharacterized protein OS=Mus musculus OX=10090 GN=Dr1 PE=2 SV=1;sp|Q91WV0|NC2B_MOUSE Protein Dr1 OS=Mus musculus OX=10090 GN=Dr1 PE=1 SV=1,153820,180000,153830,159010,99599,155220
"sp|Q3UMR5|MCU_MOUSE Calcium uniporter protein, mitochondrial OS=Mus musculus OX=10090 GN=Mcu PE=1 SV=2",1305700,738570,1036600,1015200,708220,1155000
sp|Q3UMU9|HDGR2_MOUSE Hepatoma-derived growth factor-related protein 2 OS=Mus musculus OX=10090 GN=Hdgfl2 PE=1 SV=1,53922,60600,47960,38647,26774,60211
tr|Q3UN71|Q3UN71_MOUSE Uncharacterized protein OS=Mus musculus OX=10090 GN=Cpne6 PE=2 SV=1;sp|Q9Z140|CPNE6_MOUSE Copine-6 OS=Mus musculus OX=10090 GN=Cpne6 PE=1 SV=1;tr|Q3UYN2|Q3UYN2_MOUSE Copine-6 OS=Mus musculus OX=10090 GN=Cpne6 PE=1 SV=1,10735000,11357000,9602900,8166800,7161800,9199100
tr|Q6P250|Q6P250_MOUSE Nxt2 protein (Fragment) OS=Mus musculus OX=10090 GN=Nxt2 PE=2 SV=1;sp|Q9QZV9|NXT1_MOUSE NTF2-related export protein 1 OS=Mus musculus OX=10090 GN=Nxt1 PE=1 SV=2;sp|Q3UNA4|NXT2_MOUSE NTF2-related export protein 2 OS=Mus musculus OX=10,262300,240540,255180,186730,159240,302780
sp|Q3UNH4|GRIN1_MOUSE G protein-regulated inducer of neurite outgrowth 1 OS=Mus musculus OX=10090 GN=Gprin1 PE=1 SV=2,3797400,5057400,2895500,4203700,2065200,4855700
tr|Q3URS8|Q3URS8_MOUSE Uncharacterized protein OS=Mus musculus OX=10090 GN=Mlf2 PE=2 SV=1;tr|Q3UNV7|Q3UNV7_MOUSE Uncharacterized protein OS=Mus musculus OX=10090 GN=Mlf2 PE=1 SV=1;sp|Q99KX1|MLF2_MOUSE Myeloid leukemia factor 2 OS=Mus musculus OX=10090 GN=M,411030,521310,387070,296170,227730,478460
tr|S4R2A9|S4R2A9_MOUSE Protein transport protein Sec31A (Fragment) OS=Mus musculus OX=10090 GN=Sec31a PE=1 SV=1;sp|Q3UPL0|SC31A_MOUSE Protein transport protein Sec31A OS=Mus musculus OX=10090 GN=Sec31a PE=1 SV=2,1593900,1356600,1358000,1290900,992450,1581900
tr|Q7TMU5|Q7TMU5_MOUSE Iqgap2 protein (Fragment) OS=Mus musculus OX=10090 GN=Iqgap2 PE=2 SV=1;sp|Q3UQ44|IQGA2_MOUSE Ras GTPase-activating-like protein IQGAP2 OS=Mus musculus OX=10090 GN=Iqgap2 PE=1 SV=2,5788,8376,2804.9,4078.2,5252.9,13945
tr|Q3UQD0|Q3UQD0_MOUSE Uncharacterized protein (Fragment) OS=Mus musculus OX=10090 GN=Tomm40 PE=2 SV=1;sp|Q9QYA2|TOM40_MOUSE Mitochondrial import receptor subunit TOM40 homolog OS=Mus musculus OX=10090 GN=Tomm40 PE=1 SV=3,198410,113490,166350,171410,163080,218900
tr|Q3UQM7|Q3UQM7_MOUSE Uncharacterized protein OS=Mus musculus OX=10090 GN=Slc7a5 PE=2 SV=1;sp|Q9Z127|LAT1_MOUSE Large neutral amino acids transporter small subunit 1 OS=Mus musculus OX=10090 GN=Slc7a5 PE=1 SV=2,252600,301000,327510,198670,146720,269970
"sp|Q3URE1|ACSF3_MOUSE Acyl-CoA synthetase family member 3, mitochondrial OS=Mus musculus OX=10090 GN=Acsf3 PE=1 SV=2",297120,411780,348250,264830,141820,378180
"tr|Q3URG1|Q3URG1_MOUSE RIKEN cDNA 2900041A09, isoform CRA_a OS=Mus musculus OX=10090 GN=Tppp PE=1 SV=1;sp|Q7TQD2|TPPP_MOUSE Tubulin polymerization-promoting protein OS=Mus musculus OX=10090 GN=Tppp PE=1 SV=1",20447000,23778000,14545000,20466000,20913000,15437000
tr|Q3URM4|Q3URM4_MOUSE Uncharacterized protein OS=Mus musculus OX=10090 GN=Erp44 PE=2 SV=1;sp|Q9D1Q6|ERP44_MOUSE Endoplasmic reticulum resident protein 44 OS=Mus musculus OX=10090 GN=Erp44 PE=1 SV=1,14322000,15961000,13633000,11149000,7501600,15643000
sp|Q3URS9|CCD51_MOUSE Coiled-coil domain-containing protein 51 OS=Mus musculus OX=10090 GN=Ccdc51 PE=1 SV=1,703460,930290,891550,468100,407380,722850
tr|Q3URZ9|Q3URZ9_MOUSE Uncharacterized protein (Fragment) OS=Mus musculus OX=10090 GN=Cspg4 PE=2 SV=1;sp|Q8VHY0|CSPG4_MOUSE Chondroitin sulfate proteoglycan 4 OS=Mus musculus OX=10090 GN=Cspg4 PE=1 SV=3,125680,121520,114130,102960,77969,114210
tr|Q3US73|Q3US73_MOUSE Uncharacterized protein OS=Mus musculus OX=10090 GN=Cyp46a1 PE=1 SV=1;sp|Q9WVK8|CP46A_MOUSE Cholesterol 24-hydroxylase OS=Mus musculus OX=10090 GN=Cyp46a1 PE=1 SV=1,2802700,2223000,3058200,2348000,1959800,3411500
sp|Q3USB7|PLCL1_MOUSE Inactive phospholipase C-like protein 1 OS=Mus musculus OX=10090 GN=Plcl1 PE=1 SV=3,207440,295190,229240,240600,121800,307450
tr|Q3USC7|Q3USC7_MOUSE Ganglioside-induced differentiation-associated protein 1-like 1 OS=Mus musculus OX=10090 GN=Gdap1l1 PE=1 SV=1;sp|Q8VE33|GD1L1_MOUSE Ganglioside-induced differentiation-associated protein 1-like 1 OS=Mus musculus OX=10090 GN=Gdap1l1 P,5104700,6135300,4765700,4370300,3498200,5366300
tr|Q3USR5|Q3USR5_MOUSE Uncharacterized protein OS=Mus musculus OX=10090 GN=Fbxo2 PE=1 SV=1;sp|Q80UW2|FBX2_MOUSE F-box only protein 2 OS=Mus musculus OX=10090 GN=Fbxo2 PE=1 SV=1,1676300,1855400,1780400,1573600,1027800,1956100
"tr|Q3USW3|Q3USW3_MOUSE Transmembrane protein 10, isoform CRA_b OS=Mus musculus OX=10090 GN=Opalin PE=1 SV=1;sp|Q7M750|OPALI_MOUSE Opalin OS=Mus musculus OX=10090 GN=Opalin PE=1 SV=1",193600,280810,308100,201800,178160,295780
tr|Q6ZPM1|Q6ZPM1_MOUSE MKIAA1589 protein (Fragment) OS=Mus musculus OX=10090 GN=mKIAA1589 PE=4 SV=1;tr|Q3UT32|Q3UT32_MOUSE Uncharacterized protein OS=Mus musculus OX=10090 GN=Zfyve1 PE=2 SV=1;sp|Q810J8|ZFYV1_MOUSE Zinc finger FYVE domain-containing protein,261460,303180,248220,222440,158750,272760
